,과목코드,강의이름,교수이름,학기구분,이수구분,학점,사용자이름,총평,출석체크,난이도,학습량,학점,성취감,강의평
651,ARDE278,디자인과조형(영강),김보섭,2018-2학기,전공선택,3,허헣헝,4,5,4,4,4,3,"교수님은 이번에 첨 오신 분이셔서 그런지 굉장히.. 열정맨이십니다... 첫날부터 과제를 주시길래 드랍할까 했었지만.. 걍 들었습니다..ㅎㅎ

강의명만 보면 조형과 수업으로 오해할 수 있지만 디자인 수업이에요! 디자인에서의 조형성..? 그런 내용을 배웁니다. 수업 시간에 배운 이론적인 내용을 토대로 과제가 나가요. 제품의 형태에 집중한 과제를 내주십니다. 그리고 과제는 매주 나가고, 과제에 대한 발표나 피드백은 다음 시간에 이뤄집니다. 과제는 구글프레젠테이션이랑 스프레드시트로 업로드하는 형태로 해서 서로 과제를 볼 수 있고, 교수님이 글로 피드백도 적어주셔요.

그리고 원래 영강이기도 하고, 이번에 외국인 학생분들이 몇 있으셔서 부분 부분 영어로 강의를 진행하셨습니다. 근데 뒤로 갈수록 힘드시고 학생들도 수업을 잘 안들으니 영어로 많이 안하시더라고요.

출첵은 매번 하셔요. 심지어 학생들 얼굴까지 외우시고... 수업 외 시간에도 면담 신청하시면 받아주셔요! 교수님도 많이 해주길 바라시기도 하고.. 다른 강의 과제에 대해서도 여쭤봐도 잘 해주십니다. 글고 뜬금없지만.. 교수님 쿼카 닮으셨어요...."
652,ARDE278,디자인과조형(영강),김보섭,2018-2학기,전공선택,3,아요이,5,4,3,4,5,4,"교수님께서 정말 친절하시고 항상 수업준비 열심히하시고 강의하셔서 좋아요.
열심히 과제 제출다하고 하면 학점 정말 잘 주십니다."
653,ARDE278,디자인과조형(영강),김보섭,2018-2학기,전공선택,3,피콕,5,5,3,3,5,5,"김보섭 교수님이 새로 부임하시고 하신 강의입니다.
영강이지만 영강같지 않은, 영어를 쓰면 학생들과 선생님들 모두 부담스러워하는 그런 수업이었습니다.
조형에 대하여서 4파트로 나눠서 ""자신의 개성을 언어로 표현하고 그걸 조형으로 / 자연물을 조형으로 / 기하도형만으로 조형을 / 토스터의 역사흐름 중 하나를 짚고 그걸 현대적 조형으로
일케 네가지를 다뤘습니다.
중간은 휴강으로, 기말은 최종 과제 제출로 그냥 매주 과제를 제출한다고 생각하면 됩니다.
스케치 + 디스크립션 제출이었습니다.(구글 드라이브로)
교수님이 열심히 하면 그만큼 알아주십니다. 출석 매일 하십니다."
654,ARDE278,디자인과조형(영강),김보섭,2018-2학기,전공선택,3,joekook,5,5,4,3,5,5,"수업 제목 그대로 디자인과 조형에 대해 알아보는 수업입니다. 즉, 제품의 미의 기준에 대해서 알아보고 다양한 방법으로 '아름다움'을 찾는 수업입니다. 마케팅이랑 팀플로 점철된 디자인과 수업 중에서 나름 힐링 강의라고 할 수 있습니다. 과제는 수시로 나가고 대략 주제에 맞게 스케치를 3장씩 그려오는 것입니다. 좋았던 점은 교수님께서 열심히 강의를 준비해 오시며 수직적인 분위기보다는 수평적인 분위기로 학생들과 계속 소통하려고 하셨기 때문에 수업이 즐겁고 배울 점도 많았습니다. 다만 수업이 미의 기준을 공부하는 수업이다 보니 '나는 예쁘다고 생각하는데 교수님은 아닌가보구나'라는 생각이 종종 들 수 있습니다. 그렇다고 막 학생을 몰아붙이진 않으시고, 충분한 근거와 설명이 있으면 생각을 조율해나가십니다. 교수님이랑 많이 대화해보세요. 친절하게 잘 대답해주십니다."
655,ARDE278,디자인과조형(영강),김보섭,2018-2학기,전공선택,3,티셔츠,5,5,2,2,5,4,출석은 거의 항상 하셨던 것 같습니다. 매주 스케치 1장에서 3장정도 분량의 과제가 나옵니다. 과제를 올리면 수업전까지 피드백을 해주시는데 어떤 부분이 아쉬운지 좋은지 등을 이야기해주십니다.
656,ARDE278,디자인과조형(영강),김보섭,2018-2학기,전공선택,3,후하후하,5,5,3,3,3,4,교수님 너무 귀여우시고 첫 수업이셔서 열의가 많으셨다. 매주 과제만 잘 제출한다면 학점도 잘 주시는듯! 스케치가 많아서 야아아악간 디표기 같지만 그것보단 편한 수업!
657,ARDE278,디자인과조형(영강),김보섭,2018-2학기,전공선택,3,니모니,4,5,3,4,4,3,"매주 과제가 있고, 제출 기한이 토요일까지라는 점이 단점이라면 단점일 수 있습니다.
하지만 교수님이 학생들을 정성껏 피드백해주시고, 매주 과제를 잘 제출한다면 좋은 결과 얻을 수 있을 것 같습니다."
658,ARDE278,디자인과조형(영강),김보섭,2018-2학기,전공선택,3,어마뮤유너나누e,1,5,4,3,4,4,"교수님이 좋으시고
피드백을 잘해주십니다
구글 독스를 사용한 수업방식이 편하고 좋았음!"
659,ARDE125,현대아시아미술개론,조은정,2018-2학기,교양,3,안녕하세요2,3,3,3,3,4,3,"수업시간에 열심히만 들으면 얻어갈게 없지는 않을 것 같지만, 수업시간에 집중하기가 꽤나 힙듭니다... 시험도 ppt만으로도 충분히 커버 가능하기 때문에
부담은 없는 수업인 것 같습니다"
660,ARDE125,현대아시아미술개론,조은정,2018-2학기,교양,3,나도드디어쿠클루,5,5,5,5,5,5,"수업내용 정말 유익하고 배울것 많아요
학습분량은 별로 많지 않구요
교수님 정말 친절하십니다.
미술사적 지식이 없어도 수업듣기 어렵지 않구요
인문계면 수업듣기 확실히 수월하시긴하겟네요
시험은 두번 보는데 수업내용에 충실하고 암기할 내용은 거의 없어요
수업 정말 재미잇고 미술사를 보는 시각을 제고해보는 시간을 가질 수 잇어요"
661,ARDE125,현대아시아미술개론,조은정,2018-2학기,교양,3,고나,4,5,3,3,5,3,시험은 중간고사만 보고 기말을 팀플로 대체합니다. 관심있는 미술 분야에 대해 발표나 영상으로 만들어서 제출하면 되기 때문에 힘든 팀플은 아닙니다. 시험 난이도도 높지 않기 때문에 조금만 공부하시면 충분히 좋은 성적을 얻으실 수 있습니다.
662,ARDE125,현대아시아미술개론,조은정,2018-2학기,교양,3,oneandonly,5,5,3,2,4,5,"교수님의 현장 백그라운드 지식과 놀라운 강의력, 그리고 예리한 통찰력으로 수업의 내용도 좋지만 교수님의 인품과 능력을 본받고 싶다는 생각을 참 많이 하게 됨.

시험은 중간고사만 있고, 기말은 영상과제물 제출로 대체된다. 이게 제일 좋은 부분이었다
라고 생각했으나 기말에서 과제 및 발표 준비로 생각보다 많은 시간을 써야했고 자발적으로 자료 조사를 하고 발표를 준비하는게 어려웠당 ㅎ."
663,ARDE125,현대아시아미술개론,조은정,2018-2학기,교양,3,Hs__,5,5,3,3,5,4,성취감도 있고 수업 난도도 무난했어요. 학점 잘 주시는 것 같습니다.
664,ARDE125,현대아시아미술개론,조은정,2018-2학기,교양,3,I0w0I,5,5,3,3,5,3,"마치 박물관이나 미술관가서 큐레이터한테 설명듣듯이 슉슉슉 들으면 참 좋다!
나긋하시고 설명도 잘하셔서 쉬어가는 타임으로 듣기 좋음

출첵은 매번하시지만 지각 몇번 했는데도 에이쁠 나온거 보면 그렇게 큰 지장은 없는듯함

수업은 한번 외부에서 하는수업 있는데 그냥 전시회 놀러가는 것같고 재밌음

서술형으로 된 중간이 있고 기말이 없는데 (기말이 팀플 발표대체임)
그래서인지 사람들이 기말 이후부터는 발표 준비하거나 자기 공부하거나 함
중간 시험은 서술형으로 한 세문제?정도 나오고
수업때 한 내용 이해하고 중요한 포인트만 외우는 정도로 공부해도 잘 볼 수 있음

성적은 잘 주심"
665,ARDE125,현대아시아미술개론,조은정,2018-2학기,교양,3,whdrkd,5,5,3,3,5,3,"우선 교수님이 매우 친절하시고 아는 것이 많으십니다. 중간고사 한번에 기말은 과제 대체인데 이 과제도 동영상이나 PPT 둘 중에서 원하는 방식으로 발표하면 됩니다. 팀을 꾸리고 싶으면 최대 3명까지 꾸릴 수 있으며 원치 않는다면 1인 발표도 가능합니다. 수업은 다소 지루한 감이 있지만 관심이 많은 분들은 재미있게 들을 수 있는 내용입니다. 교수님께서 말을 끝까지 맺지 않는 경향이 있으시고 목소리가 작으셔 뒤에 앉을 때는 잘 들리지 않았습니다. 하지만 234교시라 점심시간이 없는 학생들을 비교하여 항상 30분 정도 일찍 마쳐주시고, 학생들을 배려하는 것이 눈에 보였습니다. 과제나 시험방식들을 정할 때도 항상 학생들의 의견을 물어보고 반영해주셨습니다. 중간고사는 논술형이고 3-4문제 정도였던 것으로 기억합니다. 미술관 관람도 한 번 있고 자율관람 후 레포트 제출도 한 번 있습니다. 일주일에 한 번 수업인데 휴일도 겹치고 미술관 관람도 하다보니 중간고사 전까지 나가는 진도가 거의 없어 시험범위는 다른 교양에 비해 매우매우 적었습니다. ppt양은 방대하지만 대부분 사진과 그림이라 외워야 할 것도 많지 않았습니다. 기말 수업은 아예 시험에 들어가지 않다보니 학생들 집중력도 매우 떨어지고 지금 저도 기억나는 것이 많지 않습니다. 기말 과제는 수업내용과 무관하게 원하는 주제로 발표할 수 있으며 발표가 끝난 후 질의응답을 받습니다. 교수님께서 꽤나 날카로운 질문을 하시지만 성적은 후하게 주시는 것 같습니다."
666,ARDE125,현대아시아미술개론,조은정,2018-2학기,교양,3,나최고,4,5,4,4,3,4,"교수님이 여러모로 친절하십니다.
기말과제를 팀플 혹은 개인 발표로 진행합니다.
레포트 과제가 한번 있었습니다.
관심이 있다면 들어보면 좋은 경험이 될 것같아요.
흥미롭게 수업 잘 들었습니다."
667,ARDE125,현대아시아미술개론,조은정,2018-2학기,교양,3,minute78,4,5,3,3,4,3,"디자인조형학부 전공과목임을 모르고 들었던 수업입니다. 주 1회 수업이라 월요일은 힘들고 수요일은 좋고 그랬던 것 같네요. 여담으로 교수님이 미술계에서는 꽤 유명하신 분인 것 같았습니다. 잘은 모르지만요.
이번 학기는 연휴도 있었고, 중간에 미술관 견학도 있었고, 그 후에 한글날이었나에도 박물관 개인견학으로 대체해서 휴강하고, 교수님 개인사정으로 수업을 빨리 끝내주신 적도 있어서 사실상 수업한 날이 많지 않았습니다. 디자인조형학부 전공과목임에도 그냥 무난하게 들을 수 있는 교양수준이었던 것 같은데, 그와 별개로 수업내용은 미술에 문외한인 저도 제법 흥미로웠습니다. 물론 잘 와닿지 않는 내용도 종종 있었지만요.
시험은 중간고사만 봤고, PPT로 수업하셨던 내용에 대해 서술형 4문제가 출제되었습니다. 수업시간에 열심히 필기하시고 아는 내용 다 적어내면 돼서 그렇게 어렵지는 않았던 것으로 기억합니다.
기말고사는 팀플로 대체했는데, 팀을 1~3인까지 수강생들이 자율적으로 정하게 하셔서 독강에다가 미술 문외한인 저는 처음에 좀 걱정이 많았었습니다. 그래도 교수님이 엄청난 결과물을 기대하시는 건 아니었던 것 같고, 다른 수강생분들 발표를 봤을 때도 그냥 무난한 수준이었어서 독강으로 들으시는 분들도 별로 걱정할 필요는 없을 것 같습니다.
전체적으로 무난한 교양 정도이며, 미술에 관심 있으신 분들이 들으면 더 좋을 수도 있겠지만 관심이 없는 분이 들으셔도 크게 어려움을 없을 것 같습니다."
668,ARDE125,현대아시아미술개론,조은정,2018-2학기,교양,3,23425245245,4,5,3,4,3,4,"나쁘지 않은데
교수님이 중요한내용 말씀하실때 목소리가 작아지는,,, 경향이 있으셔서
무조건 앞자리 앉으시는게 좋을것같고 출석은 항상체크하시고 내용은 어렵지 않지만 방대하고
시험은 자세히 외우는것보다 맥락을 이해하는게 중요한 수업입니다"
669,ARDE125,현대아시아미술개론,조은정,2018-2학기,교양,3,댕댕이와팬더,4,5,1,2,4,3,"받은 성적 : A+

출석체크 : 출석체크는 정시에 칼같이 하세요! 저는 항상 출석해서 출석 빠지는 게 학점에 얼마나 영향이 있는지는 모르겠는데, 제 동기는 한 번 지각하고는 A+ 받았습니당

난이도 및 학습량 : 교양답게 쉬운 편! 중간고사만 시험이라 학습량은 적은 편이에요!

평가 방식 : 출석 + 보고서 + 중간고사 + 기말발표 로 평가받습니당. 출석은 앞서 말씀드렸다시피 칼같이 하시는 편이고, 보고서는 국립중앙박물관 아시아관 관람 후 표지 포함 A4 3장 작성하는 거였어요. 보고서는 자신의 언어로 작성하라고 하셨고, A4 3장 넘지 말라고 그러셨던 것 같네요. 저는 정말 제가 느끼는 대로 막 썼어요ㅋㅋ 기말 발표는 그냥 현대아시아에 대한 주제를 아무거나 정해서 3명 이하로 팀 짜서 발표하는 거였어요! 영상이나 PPT 발표 둘 중에 하나로 선택할 수 있어요! 주제 정하는 게 어려울 수 있으니 주제 미리미리 생각해두면 좋을 것 같네요

시험 : 중간고사는 긴 서술형으로 된 문제 3개였어요 (원래 4문제 중에 3문제 골라서 작성하는 거였나..? 그랬는데 교수님이 시험 범위를 헷갈리셔서ㅋㅋㅋ 4문제 중 하나가 안 배운 내용이었어요..그래서 그 문제 취소하고 남은 3문제 다 작성하는 거로 바뀌었어용) 저는 필기를 열심히 했었지만, 시험문제는 PPT에 나온 글씨만 잘 외우면 다 쓸 수 있는 내용이었어요! 저는 1, 2번 잘 쓰고, 3번을 망했는데, 3번이 친구 말로는 수업시간에 아주 살짝 지나가듯이 말씀하셨다고 그러더라구요ㅠㅠ 그래서 취소는 안 됐지만, 중간고사 후 나가는 진도에 그대로 나와있더라구요!! 아무래도 교수님이 그 문제도 범위 헷갈리신 것 같....다는 생각이 개인적으로 드는데, 결론적으로는 교수님이 시험범위 헷갈리시지만 않으면 PPT만 아주 잘 외우면 시험문제는 문제 없다는 것!

학점 : 저는 열심히 한 편이라 꿀 빨 수 있는지는 잘 모르겠지만, 이전 클루평 봐도 성적 잘 주시는 것 같아요!

아쉬운 점 : 교수님이 약간 꼼꼼한 편은 아니신 것 같아요ㅠㅠ 기말발표를 두 번의 수업에 걸쳐서 했는데, 가위바위보를 해서라도 각 날짜에 팀 배분을 비슷하게 했어야 하는데 그냥 이 날짜에 하고 싶은 사람 이 날짜에 하세요. 이런 식이었어서 두 번째 발표날에는 발표할 팀들이 몰려서 수업시간을 과하게 넘기는 바람에 마지막 사람 발표 중에 사람들 다음 수업 가야해서 막 나가고...그래서 안타까웠어요ㅠㅠ 시험 범위도 헷갈리시고.."
670,ARDE125,현대아시아미술개론,조은정,2018-2학기,교양,3,원통,5,5,5,1,4,5,"중간은 강의자료, 필기 두세번 정독으로 끝.

기말은 발표인데 팀플로해도되고 개인으로해도됨.

발표 싫어하는 사람은 고려하세요."
671,ARDE125,현대아시아미술개론,조은정,2018-2학기,교양,3,어흥아니고으헝,4,3,3,4,4,3,"이 수업은 디자인조형학부 전공으로 알고 있는데, 미술에 대해서 전혀 모르는 제가 듣기에도 나쁘지는 않은 수업이었습니다.
수업은 교수님께서 준비하신 ppt를 보면서 교수님께서 설명해주시는 방식으로 이루어집니다.
현대미술의 개념부터 오리엔탈리즘, 일본미술 등 여러가지에 대해서 배웁니다.

시험은 중간에만 있는데, ppt를 잘 외우면 시험은 무난하게 보실 수 있을 것 같습니다.
그런데 시험에 한번도 본적없는 용어가 적혀있는 문제가 있어서 엄청 당황했는데, 교수님이 안 가르쳐주신 것을 모르고 문제를 내셨던 것이었습니다ㅎㅎ..

중간에 한번 같이 전시를 관람하는 수업이 있고, 각자 박물관에 갔다가 보고서를 내는 과제도 있었습니다.

기말에는 조별발표를 하는데, 조는 1-3명 정도로 마음대로 짜서 하는 것이고, 주제는 현대아시아미술에 관련된 아무거나입니다. 전공생이 아니라서 주제를 정하는 것이 제일 어려웠던 것 같습니다ㅠ
그래도 성적은 괜찮게 주시는 것 같습니다!

교수님께서 자주 늦으시고, 조별발표 일정을 정하는 것이나, 발표시간을 배분하는 등의 수업진행에 있어서 관심이 없으신 것 같은 느낌이 있어서 조금 불편한 점은 있었습니다"
672,ARDE125,현대아시아미술개론,조은정,2018-2학기,교양,3,rythfh,3,5,3,3,4,4,"출석, 중간고사, 전시감상문, 기말발표(팀플) 이렇게 다 있습니다. 중간고사는 제가 공부를 안 해서 조금 어려웠어요. 한 챕터의 포괄적인 것을 묻는 문항이 주가 되었던 것 같습니다. 전시감상문은 비중이 큰 과제는 아니라, 적당히 썼습니다. 평가 기준 중에서는 기말 발표가 가장 중요한 것 같아요.
기말 발표는 혼자 할지, 팀으로 할지 선택할 수 있습니다. 발표 주제가 광범위해서 주제 잘못 선정하면 정말 어렵게 발표해야 합니다. 그런데 잘 하면 점수를 굉장히 크게 주십니다. 중간고사가 망해서 성적이 안 좋게 나올 줄 알았는데, 기말 발표 때문인지 생각한 것 보다 훨씬 좋은 점수를 주셨더라고요.
교수님은 좋은 분이긴 한데 조금..강의에 열정적이진 않습니다. 그게 수업에 영향을 끼칠 정도는 아니지만요. 저는 전반적인 미술사나 미학은 조금 알고 있어서, 수업 자체는 약간 지루했습니다. 수업 내용보다는 교수님이 가끔 하시는 사담이 더 유익했던 것 같아요. 좋은 미술관의 기준은 어디에 있다고 생각하는지, 혹은 요새 어떤 작품이 옥션에 많이 나오는지.. 이런 얘기를 가끔 하십니다.
암튼 그냥 적당히 하면 적당히 끝낼 수 있는 수업이라고 느꼈습니다. 정말 적당해요.."
673,ARDE283,"입체기초조형 주전공생 및 다중전공,편입생, 융합전공 수강가능*담당교강사 변경: 정소연 -> 함연주",함연주,2018-2학기,전공선택,3,앙김오딩,4,4,4,4,4,4,"누드크로키도 하고 수업도 본인이 열심히 하면 재밌음.
단 출석 빡세고 과제 성실하게 해야함."
674,ARDE283,"입체기초조형 주전공생 및 다중전공,편입생, 융합전공 수강가능*담당교강사 변경: 정소연 -> 함연주",함연주,2018-2학기,전공선택,3,난나,4,5,3,2,4,4,모든 학생들에게 열정 있는 교수님입니다! 특유의 감탄사 연발하시면서 칭찬도 잘 해주시고요 조형에 관해서 오랫동안 연구하신 분 같았습니다. 열심히만 하면 성적은 잘 주십니다.
675,ARDE283,"입체기초조형 주전공생 및 다중전공,편입생, 융합전공 수강가능*담당교강사 변경: 정소연 -> 함연주",함연주,2018-2학기,전공선택,3,아아아앙졸려,4,5,2,2,3,4,"저와 같은 융합전공생을 위해서 평가를 남깁니다 ☆

그림과 만들기와는 초등학교 이후로 단절했던 사람으로서 신선하고 재밌었음!!
무언가 예술적으로 표현해내야한다 라고 생각하니 처음에는 마냥 어렵고 그랬는데
교수님이 1대1로 지도 정말 잘해주시고
수업 때마다 열심히 뭔가를 하려고 노력만 한다면
전공학생들 따라갈 수 있어요 화이팅~!"
676,ARDE283,"입체기초조형 주전공생 및 다중전공,편입생, 융합전공 수강가능*담당교강사 변경: 정소연 -> 함연주",함연주,2018-2학기,전공선택,3,히히326,5,3,1,3,5,5,정말 작업할 때 사용할 수 있는 팁들을 알려주셔서 좋았습니다. 교수님 정말 좋아요.
677,ARDE275,기초디자인-3D 타전공생 수강 불허,인치호,2018-2학기,전공선택,3,yooyuutong,5,5,4,4,5,4,전공생한테 추천 할 만한 수업이다. 작업량 좀 많지만 잘 따라가기만 하면 a+ 받을 수 있음
678,ARDE275,기초디자인-3D 타전공생 수강 불허,인치호,2018-2학기,전공선택,3,클루호랑이,4,5,4,4,4,4,"할때는 많이 힘들다고 느껴지는 수업입니다.
과제는 여러개가 있지만 Think box 만드는게 주 과제고 디자이너를 얼마나 잘 관찰했는지와 깔끔하게 만드는게 중요해요. 상자 제작 과정에서 실수 안하도록 잘 알아보고 하시는 걸 추천합니다."
679,ARDE275,기초디자인-3D 타전공생 수강 불허,인치호,2018-2학기,전공선택,3,쿠클루우,1,5,4,3,4,4,무조건 마감을 잘하세요 마감. 마지막에 한번에 다 해가는거보다는 진행상황 꾸준히 공유 하는게 더 좋은 것 같아요
680,ARDE275,기초디자인-3D 타전공생 수강 불허,인치호,2018-2학기,전공선택,3,rkfka711,5,5,5,5,5,5,교수님 성적은 잘 주셔요 일단 띵박이랑 과제만 잘 해가고 성실하게 해가는 모습 보여드리면 잘 받을 수 있을 거에요
681,ARDE275,기초디자인-3D 타전공생 수강 불허,인치호,2018-2학기,전공선택,3,rjawl,5,5,5,5,5,5,과제는 정말정말 많습니다. 이번 학기에 2전공만 들었는데도 엄청 빡셌습니다. 스프레이 뿌려서 도색하고 아크릴 잘라 붙이고 사포질... 노가다입니다. 이 전공을 들으실 때는 다른 전공은 잠시 내려놓으세요. 그래도 갓치호 교수님 학점은 정말 잘 주십니다! 지각 두 번 정도는 아무것도 아닙니다! 갓치호 교수님 충성충성
682,ARDE275,기초디자인-3D 타전공생 수강 불허,인치호,2018-2학기,전공선택,3,가갸,4,5,3,3,4,4,디자인을 전공으로 하는 학생들에게 목업의 과정을 몸소 배우게 해주는 과목이다.
683,ARDE275,기초디자인-3D 타전공생 수강 불허,인치호,2018-2학기,전공선택,3,깜트,5,5,5,5,5,5,"교수님 무뚝뚝 하신데 학생들 은근 많이 신경써 주십니다. 이 수업 덕분에 제 통장 조금 빈곤해 졌지만,,배운건 진짜 많아요. 하긴 그렇게 시간을 많이 투자해야 하는데 배운게 없는게 이상하네요. 아마 동대문에 재료 구하러 가시게 될 수도 있는데 일찍 가서 구경 많이 하세요. 재밋는거 엄청 많아요.ㅋㅋㅋ 솔찍히 과정은 너무 힘들었고 중간 중간 내가 이러려고 고대왔나 현타도 오긴 하는데, 끝나고 나면 남는 것도 있고 뿌듯하기도 하고 학점도 교수님이 엄청 잘주시니까 미화되는 과목이네요. 안타깝지만 산디 가시려는 새내기 분들은 선택의 여지가 없어요. 들으세요. 들으셔야 해요.ㅎㅎ 힘내시고 지나가고 나면 다 아름다운 기억으로 남을 거에요,,화이팅"
684,ARDE275,기초디자인-3D 타전공생 수강 불허,인치호,2018-2학기,전공선택,3,깨비,5,5,4,4,4,5,"기대한 만큼 학점이 나오지는 않았지만
교수님이 너무좋으시고 열정적이셔서 수업을 듣는 내내 흥미로웠습니다.

과제가 다른 과목보다 많기는 하지만 그만한 성취감을 얻은 수업이었습니다.
출첵은 조교님이 항상 하시고 오후반은 많이 빠지는 학생이나 지각하는 학생이 거의 없기때문에
열심히 나가는게 본전이에요!"
685,ARDE275,기초디자인-3D 타전공생 수강 불허,인치호,2018-2학기,전공선택,3,점민지,4,5,4,5,5,4,오전수업 추천드립니다. 오후엔 수강생이 많아 불편한 점이 많습니다. 산디 가실거면 이 수업에서 꼭 목업하는 방법 배워서 2학년 올라가세요.
686,ARDE275,기초디자인-3D 타전공생 수강 불허,인치호,2018-2학기,전공선택,3,위브,4,5,4,5,5,5,노가다에 엄청난 시간과 돈이 필요한 수업.. 할게 많고 시간도 많이 쓰고 재료비도 많이 들지만 끝나고 나면 성취감과 열심히 한만큼 나오는 성적 때문에 모든게 미화되는 수업입니다
687,ARDE275,기초디자인-3D 타전공생 수강 불허,인치호,2018-2학기,전공선택,3,교수님의씨뿌리기,3,5,5,3,3,5,노가다의 현장... 야심가득한 야망가들...그리고...눈물나는 나의 학점
688,ARDE275,기초디자인-3D 타전공생 수강 불허,인치호,2018-2학기,전공선택,3,혁내,5,5,5,5,5,5,"나는 이걸 맨첨에 들었을때 이렇게 힘들줄은 몰랐다.
이 수업을 들어야 2학년때 전공필수 들을때 수월하다고 해서 들었는데
간략하게 말하면
완전 어렵고
완전 내뜻대로 되는게 없고
완전 무한반복이고
완전 힘들지만
완전 뿌듯함
생전 처음듣는 재료들을 써보고 재료 주우러 서울을 돌아다니고 기술들도 배우고 ㅋㅋㅋ
재밌다 노력하는 자에게 A+은 껌일지니~~"
