,과목코드,강의이름,교수이름,학기구분,이수구분,학점,사용자이름,총평,출석체크,난이도,학습량,학점,성취감,강의평
1838,ARDE113,미술과문화,강태성,2017-2학기,교양,3,우이이잉,3,4,4,3,3,1,"교수님 강의력 제로.... 배운게없다..그래도
학점은 잘주시는듯...
강의력 ㄹㅇ...오졌다.."
1839,ARDE113,미술과문화,강태성,2017-2학기,교양,3,sheeyun,2,4,2,1,4,1,중간고사 기말고사는 오픈 형식으로 레포트 쓰는 거에요. 큰 주제를 던져주시면 적당히 쓰면 됩니다. 수업시간에 배우는건 교수님 의식의 흐름대로 가는거라 뭔가 남은게 없네요.. 그래도 시험에 대ㅐ한 부담이 없어서 좋습니다
1840,ARDE113,미술과문화,강태성,2017-2학기,교양,3,jocelynju,5,4,4,4,4,4,미술에 대해 많이 배울수있는 수업이에요!
1841,ARDE113,미술과문화,강태성,2017-2학기,교양,3,허니써커,4,3,3,4,5,3,"출석: 학기 초반 열심히 하시다가 후반 갈 수록 안 하시는 경향이 있습니다. 그리고 출석점수에 관대하신 편.

강의내용: 중간고사 이전에는 기계화 이후의 모더니즘, 그 후에는 포스트모더니즘, 이 두 가지의 큰 주제를 놓고 사회문화, 예술, 인문학의 범주를 넘나드는 여러 이슈들을 전달해주십니다. 물론 미술/영화가 주 토픽이긴 합니다. 범위가 넓기 때문에 비전공 수강생이었던 저에게 수업을 이해하기에는 다소 난이도가 있었습니다. 다행이었던 점은 시험 난이도와는 별개였다는 점. (시험은 쉽습니다.)

발표: 자원해서 발표 가능합니다. 모더니즘, 포스트모더니즘과 관련된 어떤 주제든 상관없습니다. 발표하면 가산점이 있는데 매우 유리합니다. 좋은 학점이 필요하신 분들은 꼭 발표하세요.

시험: 시험 2주 전에 시험문제를 알려주십니다. 예를 들면 ""모더니즘의 특성을 기계문명의 영향과 연관지어 설명하시오."", ""포스트모더니즘의 특징을 서술하시오"" 등 굉장히 넓은 범위의 주제를 던져주십니다. 그럼 2시간 동안 서술하는 구조이구요. 다만 오픈소스 테스트이기 때문에 노트북에 자료 모두 준비해서 갈 수 있습니다. 실제로 글 구성, 자료정리 시험 전날에 4시간 정도 준비하고 당일에 시험 잘 쳤습니다.

총평: 능동적이지 않다면 성취감은 떨어질 수 있으나, 학점과 출첵으로 꿀빨 수 있습니다."
1842,ARDE436,한국화스튜디오ll (수업시간 변경: 목 5-7),"정종미,이예승",2017-2학기,전공선택,3,Maxx,1,5,3,3,3,5,교수님이 너무 책임지고 잘 가르쳐요 많이 배워갑니다
1843,ARDE436,한국화스튜디오ll (수업시간 변경: 목 5-7),"정종미,이예승",2017-2학기,전공선택,3,iriel,4,1,3,3,4,5,한 학기 잘 이끌어주셔서 너무 감사합니다.
1844,ARDE436,한국화스튜디오ll (수업시간 변경: 목 5-7),"정종미,이예승",2017-2학기,전공선택,3,Rae,5,1,1,5,5,5,많이 배웠고 교수님도 아주 좋은 분이으시구요ㅎㅎㅎㅎㅎ
1845,ARDE436,한국화스튜디오ll (수업시간 변경: 목 5-7),"정종미,이예승",2017-2학기,전공선택,3,으허아,4,1,1,1,4,1,그냥 졸업전시 수업 출첵은 뭐 얼굴도장 찍는정도 자기할거하면댐 학점 잘주심
1846,ARDE117,미디어와예술언어,이재준,2017-2학기,교양,3,웅도리,3,3,3,3,3,3,열심히 하면 좋은결과 얻을 수 있습니다
1847,ARDE117,미디어와예술언어,이재준,2017-2학기,교양,3,믈랑,4,4,4,4,5,5,"다루는 내용의 범위가 넓은데도 교수님 재량으로 연결점을 찾아 수월하게 커버하시고, 두시간 내내 쉬는 시간 없는 연강임에도 매끄럽게 설명하십니다. 미디어, 예술, 철학, 기술의 네 가지 틀 안에서 시대의 흐름에 따라 쭉 전개가 되는데, 학기말이 되면 전부 이어지고 얽혀있다는 걸 느낄 수 있습니다. 중간은 과제 대체였는데 점수는 잘 주신 편이었고, 기말 시험 역시 문제를 미리 알려주신 덕분에 열심히 준비해가면 학점은 잘 받을 수 있었습니다. 관심있었던 내용이었기에 재밌게 들었고, 성취감도 높았던 강의예요! :)"
1848,ARDE117,미디어와예술언어,이재준,2017-2학기,교양,3,쿠리상,5,5,5,3,4,4,진짜 수업을 열심히 들어야함. 교수님이 원하는 수업 방향이 어떤것인지 파악하여 시험을 볼때 참고한다면 관련성 없는 전공자라도 A+를 받을 수 있음.
1849,ARDE117,미디어와예술언어,이재준,2017-2학기,교양,3,ziont,3,5,5,4,4,3,"출석 체크: 매일 하십니다. 15분 넘는 시간을 매일 출석체크에 투자하실 정도로 출석을 중요시 하십니다.
난이도 : 분명 강의를 들을 때는 대학에서 듣는 진짜 교양 , 이것이 대학 강의다 이런 느낌이 드는 데 막상 머리에 들어오는 건 하나도 없습니다. 수업내용이 무엇보다 여러 분야를 끌어다 교수님 임의로 정리한 것이고 교수님 개인적 의견을 정리한 것도 많아서 처음 들어서는 무슨 말인지 짐작하기 어렵습니다. 이게 도대체 무슨 말일까 고민하다가 수업이 끝나있어요
학습량 : 기말고사 문제 다 알려주십니다. 하지만 이게 매 수업내용을 속기사급으로 다 받아 적지 않는 이상 알 수가 없고 필기를 꼼꼼히 한다 하더라도 필기가 이해가 되지 않기 때문에 필기를 몇 번 읽어봐야 답을 대강 추릴 수 있어요. 무엇보다 중간고사가 레포트로 대체 됐는데 앞에서 말한 바 처럼 수업내용이 처음 들어서는 절대 이해가 되지 않기 때문에 필기 내용을 몇 번 다시 읽어보고 주제의 의도 자체를 파악하지 못해서 미디어아트 관련 책을 몇 권 참고하고서야 겨우 개요를 짰습니다. 이번 학기에 가장 공들일 수 밖에 없었던 교양인 것 같습니다.
성취감: 꿀강을 찾는 분들에겐 절대 절대 추천드리지 않습니다. 하지만 강의를 통해 미디어 아트라는 생소한 분야에 대해 새롭게 인식할 수 있었다는 점은 인정합니다. 또 필기 다시 읽어보고 관련 책을 찾아보며 예술이라는 분야에 대해 전혀 접해보지 못했던 새로운 시각에서 인식하고 보다 깊이 생각해볼 수 있었다는 이의가 있는 것 같습니다."
1850,ARDE117,미디어와예술언어,이재준,2017-2학기,교양,3,캉캉캉,4,5,5,5,3,5,"일단 수업 난이도 상당합니다.
인공지능이랑 포스트휴머니즘에 대해서 배우는데 제한된 시간에 워낙 많은 진도를 나가다 보니
벅차기도 합니다.
녹음이랑 놋북필기 필수입니다..
하지만 시험기간에 교수님이 문제를 미리 알려주셔서 시험공부에 대한 부담은 덜 수 있습니다.
과정이 살짝 힘들지만 결과적으로 얻는게 많은 수업이라서 추천합니다."
1851,ARDE117,미디어와예술언어,이재준,2017-2학기,교양,3,오마이고대,4,5,5,5,4,5,"수업들을 때는 너무 힘들었어요. 심리학/미학을 전공하셔서 사용하시는 어휘들이 처음에 이해하기 무척 어려운데다가 5-6교시 쉬는시간 없이 연강하시고 피피티 자료를 제공해 주지 않으십니다. 그래서 무조건 필기하고 너무 빨리 지나가서 다 못받아적을것 같으면 재빠르게 피피티를 휴대폰으로 찍어두셔야 합니다. 노트북 핸드폰 필수예요!

수업 내용은 고려대학교를 다니면서 생각을 할 수 있게 하는 몇안되는 강의였던 것 같아서 좋았네요, 미디어에 대한 지식이라던가 미디어를 활용하는 방법등을 배우는 수업은 아니고 미디어 자체를 바라보는 새로운 관점을 배울 수 있습니다.

출석체크는 매일 수업 시작할 때 하시고, 중간고사는 10페이지 내외의 레포트로 대체하였는데 수업시간에 배운 내용에 대해 사례를 찾아 개인의 생각을 더하는 주제였고, 시간은 매우 넉넉하게 주셨습니다. 기말고사는 문제를 미리 여러개 알려주시고 그 중에서 몇개를 시험에 내십니다. 그래서 기말고사 준비를 할 때 이전까지 배운 모든 내용이 필기로 남아있어야 해요. 수업시간에 다루는 내용이 많고 용어들을 잘 알아둬야 하기 때문에 필기가 없다면 기말고사 준비가 어려우실 것 같아요.

중간기말모두 피드백을 주시지는 않아서 점수를 어떻게 받았는지 모르겠지만 성실하게 최선을 다했더니 좋은 성적 나왔네요."
1852,ARDE117,미디어와예술언어,이재준,2017-2학기,교양,3,초록지붕,3,5,5,4,4,4,"뉴미디어, 사이버네틱스 미학 강의입니다. 평소에 미학에 관심이 있는 분이라면 내용은 재미있습니다. 그런데 나머지가 다 별로입니다. 내용도 조금 어렵지만 교수님 강의력이 정말 별로라서 내용 자체보다도 강의를 알아듣기가 더 어렵습니다. 별로 요점 없이 화면을 읽어주고 의식의 흐름대로 말씀하시는 분이라서 수업을 빠짐없이 열심히 들었어도 레포트를 쓰거나 시험 공부를 하려고 하면 어디서부터 어디까지가 키워드에 해당하는 내용인지 헷갈립니다. 또 교수님 젠더감수성도 많이 떨어져서 수업 하나에 한두 번 정도는 불편한 발언을 하셨고 PPT 화면 낭독은 항상 여학생을 시키면서 '나는 남녀차별주의자가 아니라 여학생 목소리가 낭랑하니 듣기 좋아서' 라고 말씀하시는 등 전반적으로 내용은 좋은데 강의가 별로입니다.

수업 내용이 복잡하고 양도 많은데 수업 자료(PPT)를 제공해주시지 않기 때문에, 녹음+노트북 필기를 열심히 했습니다. 처음에는 거의 교수님 하시는 말씀을 다 받아적었는데, 끝나고 나서 생각해 보니 키워드 중심으로 필기하고 수업이 끝난 다음에는 그 키워드 사이의 연결고리 (어떤 기계의 발명으로 다음 기계가 발명되고... etc) 를
정리하는 게 효율적인 방식인 것 같습니다.

중간고사는 레포트로 대체하고 기말고사는 시험을 봤는데, 시험 전에 문제를 다 알려주셨습니다. 문제가 다 있기
때문에 필기를 충실히 했다면 기말고사 준비에 시간을 거의 들이지 않아도 됩니다. 저는 전날과 당일날 합쳐서 4~6시간 정도 보고 쳤습니다. 레포트가 기말고사보다 훨씬 어려웠는데, 저의 경우 책을 따로 두 권 읽어야 했습니다. 클루 평대로 (그리고 교수님 스스로도 말하는 대로) 항상 앞자리에 앉고 발표 열심히 해서 교수님이 이름을 외울 정도가 되면 점수가 잘 나오는 것 같습니다. 학기 중 가장 듣기 싫은 강의였지만 A+ 나왔어요."
1853,ARDE117,미디어와예술언어,이재준,2017-2학기,교양,3,유기농,4,5,4,5,3,5,어렵고 학점받기도 쉽지는 않지만 보람있는 수업입니다. 교수님 한테 호응 잘하시고 과제하실때도 교수님 의견 반영 많이 하시는게 좋습니다. 전통적인 인간중심주의적 사고를 비판하고 해체하는 수업이라 많이 생소하고 어렵습니다. 100점에서 감점하는 방식이라 출석 많이 중요합니다. 받은 성적은 A인데 무단 결석 없었으면 + 달 수 있었을 거 같습니다.
1854,ARDE117,미디어와예술언어,이재준,2017-2학기,교양,3,asjd,3,5,5,4,4,4,교양이라고 하기에는 버거운 감이 있지만 성실한 태도를 보이면 그래도 점수는 잘주세요.. 아직도 강의내용은 헷갈림
1855,ARDE117,미디어와예술언어,이재준,2017-2학기,교양,3,포테이토,2,5,3,4,1,3,"내용자체는 유의미한 내용이라고 생각합니다.. 강의자료만 빼오고 싶은 생각이드는..
교수님이 피피티 자료를 공유를 안해요..도대체 왜 안하는지 모르겠지만..
개인적으로 강의에서 핵심적인 부분을 좀더 명쾌하게 설명이 될수 있을 것 같은데
내용이 다소 장황하고 교수 맘대로 개념을 정의내리고 거기서 도출되는 개념을 또 맘대로 정의내리는 식의 설명이 많아서 그 안에서 유의미한 부분들을 개인적으로 발굴해내야만 유의미한 수업이 될것 같습니다.
설명이 장황하고 엄청 어려운척..하는 수업인 것 같아서.. 무슨 명강인것 처럼 평가가 되는 것을 봤는데..교수가 설명력이 부족해서 다소 어렵게 느껴진다고 명강은 아닌것 같습니다..

내용은 좋아요.. 내용은 정말 좋은데.. 그 좋은 것을 결국 본인이 발굴해야하며.. 수업시간 너무길고.. 교수....이상한 소리 잘하고... 뭘 읽는거 시킬때 자꾸 낭랑한 목소리 어쩌구 하면서 여학우들 시키고... 학번 보면서 왜 아직도 졸업안했느니 전공이 뭔데 그걸 잘 모른다느니... 엄청 리버럴 한척 하는데 절대 아닌 그런 교수님인것 같습니다.

비추하고 싶은데..내용은 또 나쁘지 않아서...

중간은 보고서. 기말은 시험을 봤습니다."
1856,ARDE117,미디어와예술언어,이재준,2017-2학기,교양,3,류류류류류류류류,5,5,4,4,4,5,2년 동안 들은 강의 중 최고의 수업이에요
1857,ARDE117,미디어와예술언어,이재준,2017-2학기,교양,3,유누구,5,5,4,4,4,5,"이번 학기 배운 내용을 돌아봤을 때, 사고하는 것에 있어서 가장 많은 영향을 준 강의라고 말할 수 있는 강의.
단순한 미디어의 의미를 다루는 것이 아니라 포괄적으로 어떻게 미디어가 발전해왔고,
얼마 만큼 전면적인 것인지 다루는 수업으로서 상당한 공부를 할 수 있었다.

배우는 것이 많고, 생각하는 것이 많은 만큼 수업의 진행 방식은 다소 힘들 수 있다.
매 수업 별로 100장이 넘는 슬라이드의 ppt로 수업을 진행하시는데,
녹음이나 사진 촬영은 자유롭게 허용해주신다.
수업 양이 방대하지만, 달리 말하면 그만큼 교수님이 열정적이시다.

중간고사는 레포트로 대체했고, 기말고사는 서술형/단답형으로 나뉘어져 문제가 출제된다.
시험 이전에 어떤 문제가 나올지 제시해주시는데, 시험 이전에 수업을 열심히 들었다면 비교적 수월하다.

* 학생과의 소통을 중요시하는 교수님이셔서 수업은 최대한 앞자리에서 열심히 들어야 학점이 잘 나온다."
1858,ARDE117,미디어와예술언어,이재준,2017-2학기,교양,3,김형준,4,4,5,4,4,5,"미디어와 예술언어라고 하지만 역사 수업에 가깝습니다.
수업량이 많고, 필기할 것도 넘칩니다.

팁을 드리자면, 앞자리에 앉을수록 좋은 학점을 얻을 수 있습니다.
수업 시간이 끝나면 질문하는 것도 좋습니다. (사실 질문하지 않으면 수업 내용을 따라가기 어렵습니다.)"
1859,ARDE117,미디어와예술언어,이재준,2017-2학기,교양,3,KIMMMMM,2,5,4,4,2,3,"출석체크 빼먹지 않고 꼭 하십니다. 배우는 내용은 엄청 많습니다. 교수님이 다양한 측면에서 엄청 많이 아셔서
미디어, 기술, 문화, 예술 등 종합하신 내용에 대해서 강의하십니다. 그러나 교재가 없어서 매 강의마다 녹음을 필수적으로 해야하고 필기를 매우 꼼꼼하게 하시는 것이 좋을 것 같습니다. 기말에는 10장짜리 레포트가 있었고 꽤나 까다로운 주제였던 것으로 기억합니다. 그리고 앞자리에 앉는 것을 노골적으로 좋아하시는 분이기 때문에 앞자리에 앉는 것을 추천드립니다."
1860,ARDE117,미디어와예술언어,이재준,2017-2학기,교양,3,Korea111,4,5,5,5,3,5,"교양 다운 교양이었다.
중간 기말 둘 중 하나는 10페이지 레포트 과제로 대체 하고, 시험은 워낙 내용이 어렵다 보니 교수님이 문제를 집어서 주시기 때문에 큰 어려움은 없으실 겁니다.
수업 내용은 미디어와 예술에 관심있는 사람에게는 재미로 다가 갈 수 있지만, 이 분야에 관심 없는 사람들에게는 비추하는 과목입니다."
1861,ARDE117,미디어와예술언어,이재준,2017-2학기,교양,3,Chothy,5,5,5,3,3,5,"C+ 받았는데도 후회 안 할 만한 교양입니다. C+ 받은 건 물론 후회하구요. 그래도 이런 수업을 들을 수 있었다는
건 행운입니다. 발신자 - 매체 - 수신자로 미디어를 이해하는 뻔한 틀에서 벗어나, 물질적인 측면에서 미디어가 어떻게 발전하고 성립해왔고 하나가 되어가는지 역사적이고 구체적으로 설명해주시는데, 짧은 말로 요약할 수 있는 내용이 아닙니다. 그래서 두 시간동안 100여장의 PPT를 활용해서 설명하십니다. 양도 많고 엄청나게 어렵습니다. 어렵게 설명할 수 밖에 없는 내용인 듯 하고, 수업 도중에는 도무지 무슨 말씀을 하시는건지 잘 모르겠습니다. 하지만 내가 뭘 배우고 있는 걸까... 싶으면서도 굉장히 흡입력 있는 강의입니다. 기말시험을 준비하면서 필기한 내용을 쭈욱 훑어보면서 내용을 정리하다보면 조금씩 윤곽이 잡힙니다. 특히 오늘날 급변하는 뉴미디어 사회를 이해하는 데에는 전통적인 틀에서 정체된 미디어학보다 훨씬 설득력 있는 갈래라고 느꼈습니다.
출석도 꼬박꼬박 했고 필기도 빠짐 없이 하고 기말고사는 선방은 아니지만 나름 평타는 쳤다고 생각했는데, 중간과제를 말아 먹었나 봅니다. 배점이 크기 때문에 과제 주제 선정을 잘 하고 글을 잘 쓰셔야 합니다. 평가 기준에
교수님의 자의적인 판단이 개입하는 경향이 조금 있습니다. 하지만 여유가 된다면 뇌구조를 리셋하고 재수강할 생각입니다."
1862,ARDE117,미디어와예술언어,이재준,2017-2학기,교양,3,고래고래고래,2,5,5,5,4,4,"출석: 매일 정시에 부르십니다.
평가 기준: 출석+중간 대체 레포트+기말 고사+참여도
중간 대체 방식: 주제에 관한 레포트
기말 고사 방식: 총 수업 관련 단답식, 논술형, 교수님이 미리 문제 알려주심
학습량: 중간 편, 벗 내용이...


성취감 및 수업 분위기: 새로운 관점을 얻는 성취감, 교수님이 학생들의 질문을 원하는 수업 분위기

공부법: 앞 쪽에 앉고, 교수님에게 열정적인 자세를 보이고, 질문하고, 수업 내용 열심히 듣고,,, 이해하고... 기말 논술 답 준비해야하고....

이 수업을 왜 들어야 하냐면: 고려대학교 명강입니다 정말로, 교수님이 매 시간 논문 한 편을 저희에게 소개해주시는 기분입니다.. 아! 그리고 세상에 대한 새로운 시각을 얻을 수 있어 정말 좋았습니다."
1863,ARDE117,미디어와예술언어,이재준,2017-2학기,교양,3,포뇨정,5,5,5,5,3,5,"미디어 미학의 큰 흐름에 대해서 새로운 시각으로 접근 할 수 있었던 강의
기계의 발달로 인해 시각경험이나 청각경험들이 어떻게 대량으로 복제되었는지, 그래서 그것이 미디어와 어떤 엔관이 있는지, 예술에는 어떤 영향을, 나아가 인간에게는 어떤 영향을 미쳤는지 가르치십니다.
4년 내내 들었던 수업 중 가장 재밌게 들었던 수업 중 하나였습니다. 미학에 관심 있는 분들은 꼭 들으시길"
1864,ARDE117,미디어와예술언어,이재준,2017-2학기,교양,3,the1975,4,5,5,5,3,5,"명강이라면 명강이라고 할 수 있지만, 헬강입니다. 배우는 건 정말 많은데 강의 자료를 안올려주시고 3시간 수업에 쉬는시간 없이 100장이 넘는 ppt를 계속 설명하십니다. 그래서 녹음 필수고 촬영도 필수, 필기도 꼼꼼히 하셔야 합니다. 중간 대체 10장짜리 레포트있고 기말 한 번 봤습니다. 레포트 주제도 어려운 편입니다. 그나마 시험은 예상문제를 미리 알려주시기 때문에 공부하기 나은 편입니다. 개인적으로 전 이 수업만 하고 나면 필기하고 이해하느라 너무 바빠서 기빨리는 느낌도 들고, 사실 필기에 대한 강박 때문에 수업을 제대로 못들은게 너무 아쉽습니다. 그래도 신기한 것도 많이 배우고 새로운 시각을 전달해주신다는 면에서 재미있었습니다. 학점은 그리 잘 받은 편은 아니지만 형편없이 공부한 거에 비해서는 잘주신게 아닌가 생각이 듭니다."
1865,ARDE117,미디어와예술언어,이재준,2017-2학기,교양,3,민현이짱,4,5,5,5,3,4,출석 체크는 매번 하시고 출석의 비율이 성적에 굉장히 크다고 교수님께서도 항상 말하시고 질문 많이 하고 앞자리에 앉아서 열심히 듣는 학생들에게 에이를 주신다. 중간고사는 10장 내외 리포트로 대체하고 기말고사는 미리 문제를 알려주시는데 그래도 어렵다. 내용도 초반에는 엄청 어렵지만 갈수록 뭔가 이해가 되는 느낌이다. 열심히 했는데 학점은 그냥 그런 것 같고 시험도 나름 잘 봤는데 출석을 두 번 빠져서 그런 것 같다. 교수님 자체는 굉장히 좋으시다.
1866,ARDE117,미디어와예술언어,이재준,2017-2학기,교양,3,호롤롤로롤,2,5,5,4,3,3,"출석 맨날 하시고 한번 빠지는게 치명적임
수업하지는 내용도 철학적이라 어려움 미디어와 예술언어라는 제목보다 넓은 범위를 포괄하는데 이를 서로 철학적관점에서 연결시키는게 관건임.
학습량은 많은데 시험문제는 알려주심 객관식15문제 서술형5문제 알려주시고 객관식 10문제 서술형 3문제를 내심. 중간고사는 대체레포트였는데 분량이 헬입니다...
3시간 쉬는시간 없이 연강이다보니 정말 지칩니다. 녹음켜놓고 충분히 놀았다고 생각했는데도 30분지나있어서 절망할때가 많았어요
그래도 학점은 잘주시려고 하는편이에요
저는 씨플받을 각오하고 있었는데 비플 주셨네요 만족합니당
그치만 씨플받았어도 재수강 안했을거 같네요"
1867,ARDE117,미디어와예술언어,이재준,2017-2학기,교양,3,marvel,2,5,5,4,1,3,"이 강의... 처음에 수강신청할때 진짜 명강 중에 명강이다,
교양다운 교양이다 배우는거 많다 이래서 들었는데..
진짜 너무 어렵고 제가 이 수업을 들을 그릇이 안되나봄ㅋ
수업이 2시부터 4시반까지 2시간반 동안 진행되는데
무조건 집중해서 필기해야 함. 필기에 그치지 않고 이해까지 해야함.
앞쪽에 앉아서 질문도 많이 하고 하면 학점 잘 받을 수 있음.
그게아니면..절레절레
중간고사나 기말고사 중 하나 레포트로 대체함. 근데 이번 레포트 진짜
주제 못알아들어서 죽는줄 알았음 교수가 한국어를 못하는건가 생각도함.
미디어, 기계, 기술 이런 짬뽕 학문에 관심이 많으신 분들 들으시길 바람
분명 유익한 부분도 있지만 관심이 없다면 이해할 수 없는 소리들일 뿐. 힘들었다."
1868,ARDE117,미디어와예술언어,이재준,2017-2학기,교양,3,SW,4,5,5,5,3,5,"열심히 하면 정말 성취감만큼은 최고입니다.
그리고 강의 제목만 보시고 그냥 인문학적인 내용이라고 생각하실 수도 있는데, 굉장히 논리적이고 과학적인 내용입니다.
미디어, 사회, 예술에 관심 없으시면 매우 힘드실 것 같습니다.
강의 자료가 달랑 사진밖에 없고 자료를 올려주시지도 않아서 수업 시간에 엄청 열심히 해야 합니다.
중간 대체로 10페이지짜리 레포트 있습니다.
그리고 이 수업 내용이 전체적으로 딱딱 이론이 있는 것이 아니라, 교수님이 그동안 연구하신 분야에 대해서 강연을 듣는 느낌이라서 교수님의 개인적인 관점이 매우 강하게 드러나기도 합니다."
1869,ARDE117,미디어와예술언어,이재준,2017-2학기,교양,3,단풍,4,5,5,4,4,4,"수업 내용은 조금 어렵지만 과제랑 시험 열심히 하면 학점은 잘 주시는 것 같아요.
단, 피피티로 수업하시는데 피피티를 따로 올려주시지는 않아서 필기 열심히 해야돼요.
출석체크는 매일 하시고 교수님께서 출석을 중요하게 생각하셔요.
앞쪽에 앉는 것을 좋아하십니다."
