,과목코드,강의이름,교수이름,학기구분,이수구분,학점,사용자이름,총평,출석체크,난이도,학습량,학점,성취감,강의평
1241,ARDE115,현대디자인의이해,최재희,2018-1학기,교양,3,토끼정,5,5,3,4,4,5,"평소에 디자인이 많은 타학과 학생이었습니다
존나 듣고싶었엇는데 ㅜ인기가많은지라 3학년때 듣게되엇네요
결론은 추천입니다
현대디자인의 이해... 말그대로 디자인에 관해 간단하게 배웁니다.
내용은 제가 평소에 관심이 있었어서인지 무난했고
그렇게 어렵지도 않았어요
양도 그렇게 많지는 않은데 몰아서 하려면 힘들어요

과제는 전시회 다녀와서 자유롭게 ppt나 워드 등으로 후기 만드는것입니다
잘한거 골라서 발표시키십니다

저는 발표햇삼. 재밌었어요
그리구 시험은 5문제 다 서술형입니다
걍 아는대로 쓰는건데 . b+나올줄알앗는데 a나왓습니다

출석 중요합니다. 저 지각을 거의맨날해서 한 10번 지각했나.근데 a나왔어요
공부는 열심히 했어요
시각이 달라졌어요 진로고민도 다시하게된,, 너무재밌네요
교수님 수업 하나 더 들을려구요 너무 잘맞아요
디자인과 학생들이 딱히 잘한다거나 하는건 없는것같습니다.

하는만큼 나오는 과목이고
1교시라 출첵힘듭니다 (ㅠㅠ)

아 근데 진짜 재밌는수업이었습니다
강 력 츄 쳔"
1242,ARDE115,현대디자인의이해,최재희,2018-1학기,교양,3,hahaha23,5,5,3,4,4,4,"디자인사에 대해서 배우는 수업입니다
강의 내용은 아주 쉽고 교수님이 이해하기 쉽게 설명을 해주십니다.
피피티도 따로 올려주시지만 중간 기말때 공부 할 피피티의 양이 어마어마...
피피티 강의 내용 열심히 외워가시고 아는 만큼 쓰시면 성적은 잘 주시는듯합니다."
1243,ARDE115,현대디자인의이해,최재희,2018-1학기,교양,3,9월,5,5,3,4,3,5,교수님이 천사예요!! 모든 걸 학생 입장에서 생각해주시고 강의력도 좋으세요! 그냥 이야기 듣는 것처럼 수업만 잘 들으면 시험기간에도 교수님이 하신 말이 생각날 정도로 잘 가르치십니다. 또 디자인과 학생이 아닌 사람으로서 수업을 듣고 실생활에서 디자인 관련 배운 내용이 많이 보여서 개인적으로 진짜 교양을 들은 느낌이라 뿌듯하기도 했습니다. 과제도 미술관이나 전시회 관람하고 관람 후기를 쓰는 것인데 배운내용과 자신의 생각을 잘 엮어서 쓰면 점수를 잘 주시는 것 같아요. 학생 개개인의 의견을 존중해주시는 것이 너무 인상깊었던 수업입니다. 시험 문제도 공부한 만큼 써라는 문제라서 시험을 보고 나오면 후련한 그런 느낌이었습니다ㅎㅎㅎ 수업을 들으셔도 후회는 없을 것 같아요! 유용한 공부를 하는 수업입니다.
1244,ARDE115,현대디자인의이해,최재희,2018-1학기,교양,3,히효홋,4,5,3,3,4,4,수업이 1교시인데 9시 정각 되면 바로 출석 체크를 하십니다. 디자인의 흐름에 대해 배울 수 있는 좋은기회이고 과제는 전시회 갔다오기 한번 피피티로 만드시면 돼요. 매우 교수님께서 착하시고 세세한 부분보다는 전체적인 흐름에서 시험문제를 내니까 공부할게 많지는 않습니다. 서술형으로 쓰고 문제는 5문제 정도 중간/기말 다 시험봅니다.
1245,ARDE115,현대디자인의이해,최재희,2018-1학기,교양,3,제이제이맨,4,5,2,3,4,4,"디자인사를 배우는 수업입니다. 매수업 시작에 수업과 관련된 티비 광고 영상물을 보여주시고 교수님 열정이 느껴지는 수업이었습니다. 출석은 매일매일 하지만 1교시 수업치고는 가볍게 가볍게 들을 수 있는 내용이라 좋았습니다. 시험은 다섯문제 정도 서술형으로 출제가 되고, 수업내용과 ppt참고하시면 굵직굵직하게 사조위주로 공부하면 그렇게 어렵진 않습니다. (디자인사조에 대해 설명하거나 그 시대 사조에서 대표하는 작품/공예품을 제시하고 설명하는 식) 다만, ppt 자료를 시험 열흘 전에 올려주셔서 매수업 필기를 안한다면 ppt 받아봤을때 중요한 내용이 바로바로 캐치가 안되실수도.. 여튼좋은수업입니다!"
1246,ARDE115,현대디자인의이해,최재희,2018-1학기,교양,3,zinomi,5,5,2,2,4,5,"평소 생소한 디자인사와 미술 사조를 배울 수 있는 강의입니다.
교수님께서 경험 위주로 친절하게 설명해주셔서 쉽게 이해할 수 있습니다.
암기만 시험 때 열심히 한다면 좋은 성적 받을 수 있습니다."
1247,ARDE115,현대디자인의이해,최재희,2018-1학기,교양,3,닉값,4,5,3,4,3,4,"디자인에 대한 전반적인 시야가 넓어졌고 배우는게 많은 강의
교수님께서 오픈마인드시고 예술작품에 대한 어떠한 생각이나 평가도 존중하시고 받아들이심
출첵은 빡셈.. 안그래도 1교시라서 조금 힘들긴하지만
수업시간이 즐거웠음"
1248,ARDE263,테라코타와조형,함연주,2018-1학기,전공선택,3,퍄퍄퍄퍄,5,5,3,4,4,5,"교수님이 완전친절합니다, 실험도 많이 해보고 좋은 수업니다."
1249,ARDE263,테라코타와조형,함연주,2018-1학기,전공선택,3,나봄날애,1,3,3,2,5,2,"힐링 하고 싶으시면 이 수업을 들으세요.
물론 고려대학교 유치원까지 올라가야하는 단점이 있긴 하지만
그것만 빼면 마음대로 자기가 원하는 것 만들면서
도움이 되는 피드백 받을 수 있는 수업입니다."
1250,ARDE263,테라코타와조형,함연주,2018-1학기,전공선택,3,rythfh,5,4,1,3,4,5,"교수님이 좋은 분이에요. 수강생들 하나하나 다 신경 써주시고, 열심히 하려는 모습 보이면 많이 도와주십니다. 제일 좋은 점은 특정한 스타일이나 작업 방식을 강요하지 않는다는 거였어요. 또, 교수님이 수업때 앉아서 그냥 계시지 않는 것도 좋았어요. 여기저기 돌아다니시면서 필요한 것은 없는지, 궁금한 것은 없는지, 막히는 부분은 없는지 다 살펴보십니다.
출석체크는 거의 매일 하시고, 지각은 조금 늦은거라면 봐주셨던 것 같아요. 아 그리고 수업 특성상 기숙사 바로 위에 있는 학교 어린이집의 지하 주차장에서 합니다. 거기가 철조실이에요. 흙 만지는 수업이다보니 옷도 많이 더러워지고요. 작업복 있으면 좋아요.
저는 배운게 굉장히 많았습니다. 수업 커리큘럼을 따라가면서 배우는 방식의 강의가 아니라, 개인적으로 작업을 하면서 배우는 방식이라서 개개인마다 편차는 클 것 같습니다. 하지만 그런 수업인만큼 적극적으로 하려고 하면 얻어가는게 많아요."
1251,ARDE263,테라코타와조형,함연주,2018-1학기,전공선택,3,범수,5,5,3,3,4,4,"교수님이 너무너무너무 좋은 분 이십니다. 진짜 최고
학생들 하나 하나 개성을 최대한 존중해 주시고 작업이 더 좋은 방향으로 갈 수 있게끔 열심히 대화해 주십니다.
중간이나 기말평가는 따로 없고 마지막 과제전 끝나고 자기의 대표작 몇개랑 한학기동안 배우고 느낀점 정도 적어서 제출하고 끝납니다.

학점은 열심히 하고 다양한 걸 시도하는 사람에게 잘 주시는 것 같아요!"
1252,ARDE263,테라코타와조형,함연주,2018-1학기,전공선택,3,나최고,5,5,3,3,4,5,"연주쌤은....그냥...쵝오.....다...
무슨 강의를 하시든 일단 믿고 들어간다
과제전만을 보는 것이 아닌 학생이 스스로 작업할 기회를 주신다
그 중 선별하여 과제전에 제출한다
작년까지의 테라코타 강의와는 달리 (선생님이 바뀌심) 자유로운 주제로 다양한 기법을 학습한다
학생을 전격적으로 지지해주시는 연주쌤... 거기서 오는 성취감과 배워가는 것이 정말 많다
참교육 연주쓰...."
1253,ARDE263,테라코타와조형,함연주,2018-1학기,전공선택,3,푸왁,2,5,2,2,2,1,"매 수업마다 철조실까지 가야하는 게 제일 힘들다...

교수님은 친절하시고 학생들을 잘 챙기신다.

다만 4시간 수업동안에 흙으로 계속 뭔가를 만든다는 게 힘들었다. 계속 하다보면 나중엔 뭘 만들어야 할지 모르겠었다.

과제는 없고, 마지막에 작업일지를 제출하면 된다."
1254,ARDE311,제품디자인스튜디오lll,권민성,2018-1학기,전공필수,3,290516,4,3,3,3,4,5,"아웃풋을 내는데까지 시행착오가 많았지만 교수님의 조언덕에 결국 잘 풀어나간 것 같습니다.
현실적이고 구체적인 조언과 더불어 교수님 본인 디자인인 것 처럼 열정적으로 함께 문제를 풀어나가주세요."
1255,ARDE311,제품디자인스튜디오lll,권민성,2018-1학기,전공필수,3,zaq1,4,4,3,3,4,4,중간고사 전까지는 브라운 프라이즈 준비를 같이 했고 기말고사까지는 스니커즈 디자인을 했습니다. 개인적으로는 교수님이 친절하시고 많은 도움을 주셔서 재밌게 들은 수업이었습니다.
1256,ARDE311,제품디자인스튜디오lll,권민성,2018-1학기,전공필수,3,bLRg8QRdwS,4,3,5,3,4,4,제품 디자인에 대해 실무적으로 하는 수업입니다. 브라운 공모전에 팀을 짜서 제출하는 프로젝트가 있습니다. 조금 힘들지만 실기는 향상되는 느낌입니다.
1257,ARDE311,제품디자인스튜디오lll,권민성,2018-1학기,전공필수,3,RJ,4,5,3,3,4,4,"중간 과제, 기말 과제로 이루어진 수업입니다.
중간 과제는 팀 과제로 브라운 공모전에 참가하는 것이었고, 기말 과제는 개인 과제로 각자 유명인을 한 명 선택하고 그 유명인을 주제로 운동화를 디자인하는 과제였습니다.

기말 과제의 경우 포토샵으로 사실적인 랜더링을 하는 법을 배우는데 포토샵 실력을 많이 키울 수 있었습니다."
1258,ARDE311,제품디자인스튜디오lll,권민성,2018-1학기,전공필수,3,응아니야,3,5,3,3,4,3,"3학년 전공필수 수업인데..
내가 부족해서 교수님 뜻을 헤아리지 못한건지..

그래도 다른 강의하고 비교해서 무난한 수업이었고 점수도 잘 주심."
1259,ARDE311,제품디자인스튜디오lll,권민성,2018-1학기,전공필수,3,heather,4,5,3,3,4,4,"중간까지는 브라운 프라이즈를 준비하고 기말부터는 스니커즈 디자인을 했습니다
권교수님 수업 특성상 과제가 아주 많지는 않지만 그래도 시킨 것을 충실하게 해 가는 것이 중요해요
요구하는 것을 잘 해 가면 학점도 잘 주시는 편입니다"
1260,ARDE311,제품디자인스튜디오lll,권민성,2018-1학기,전공필수,3,dldh,4,5,4,4,4,3,초반에는 브라운 공모전을 진행하고 후반에는 신발 디자인을 했습니다. 브라운 공보전의 경우 준비 기간이 너무 짧아서 제대로 하기 어려웠어요. 신발 디자인은 페르소나를 정해서 나이키 에어포스 원을 그에 맞게 디자인하는 것입니다. 이것을 통해서 뭘 배웠는지 잘 모르겠어요..
1261,ARDE311,제품디자인스튜디오lll,권민성,2018-1학기,전공필수,3,므롱,4,5,2,3,4,3,지금까지의 제디스 수업과는 좀 다른 느낌의 수업이었습니다. 다뤄보지 않은 것들을 해보니 흥미로웠습니다. 또 교수님도 항상 피드백을 주시려고 노력하셔서 좋았습니다. 다만 문제는 피드백을 최종제출 직전 주에 몰아서 주시는 경우가 많아서 힘들었습니다.
1262,ARDE311,제품디자인스튜디오lll,권민성,2018-1학기,전공필수,3,sonya,5,5,3,3,4,5,"중간은 브라운 팀 공모전, 기말은 개인으로 나이키 에어포스 프로젝트 했구요 늘 그렇듯 타임라인과 피드백을 잘 제시해주셔서 원하시는 것도 분명하고 따라가기 어렵지는 않았습니다. 출석은 그닥 영향없는듯하고, 학점 잘주신것 같아요."
1263,ARDE311,제품디자인스튜디오lll,권민성,2018-1학기,전공필수,3,에브리띵,3,5,3,3,3,3,중간고사 전까지는 브라운공모전을 준비했고 그 이후에는 나이키 에어포스1을 한명의 페르소나를 정해서 디자인했습니다. 브라운공모전은 너무 짧은 시간에 촉박하게 진행했어요 일단 교수님이 커리큘럼 분배를 잘못하신건지 ㅠ 제출 2주전까지 아이디에이션만 했다고 보시면 돼용 하필 브라운 날짜가 중간고사때 마감이어가지고... 그렇게 급히 브라운 끝내고 나서는 갑자기 패디 1학년 과제같은 걸 주셔서 당황했지만 많은 학생들이 덕질을 페르소나로 연결시켜서 재밌긴했습니다. 재미는 있지만 우리가 이런 걸 왜 3학년 제디스에서 해야하지?? 라는 의문만 끊임없이 가졌고 학점은 하는 만큼 주시는 것 같아용
1264,ARDE311,제품디자인스튜디오lll,권민성,2018-1학기,전공필수,3,팀플혼자하고싶어요,3,5,3,3,5,3,제디스는 전필이어서 항상 가장 많은 시간을 투자하고 많은 신경을 붓는 수업인데 권민성 교수님이 진행한 제디스는 전필인것을 매번 망각하는 수업을 진행하셨습니다. 첫번째 프로젝트는 브라운공모전이었고 두번째 프로젝트는 특정 페르소나를 잡아 에어포스원을 커스텀하는 프로젝트였습니다. 브라운 공모전울 진행하는것은 좋았지만 마감기한이 중간고사라 매우 촉박하게 아이디어를 내고 급박하게 결과물을 낼수 밖에 없어 아쉬웠습니다. 두번째 에어포스원 리디자인은 같은 컴포지션이라도 cmf에 따라 다른 디자인을 만들어낸다는것을 배우는 취지였는데..사실 이것을 3학년 수업에서 해야만했어야하는지 의문이 듭니다.
1265,ARDE235,종이&섬유,"문활람,구모경",2018-1학기,전공선택,3,이게뭐라고,4,4,5,4,3,4,"교수님 케바케
채색 교수님 나름의 평가 기준이 명확하게 있는 편

한지 뜨러 갈 때는 동덕여대까지 가니
앞뒤로 시간 비우는게 마음이 편합니다."
1266,ARDE235,종이&섬유,"문활람,구모경",2018-1학기,전공선택,3,soo,1,1,1,1,1,1,"초반에는 동덕여대에 가서 한지 만들기를 하고 중후반부에는 미디어관에서 종이 염색, 기법, 활용과 관련된 실습을 합니다. 수업 외 시간에 미술관 견학하는 활동도 하고 수업활동을 기록으로 남겨 보고서를 제출하는 과제도 수행했습니다. 마지막에는 각자 작품을 완성해 전시도 합니다. 학점은 잘 주시는 것 같습니다."
1267,ARDE235,종이&섬유,"문활람,구모경",2018-1학기,전공선택,3,쥬주스,4,4,3,3,4,3,다양한 경험을 할 수 있어서 유익한 강의 였습니다.
1268,ARDE235,종이&섬유,"문활람,구모경",2018-1학기,전공선택,3,oneandonly,5,5,3,4,5,4,"타과생분들이 꽤 많으신데, 다들 너무 잘하셔서 의외로 전공자보다 더 독특하고 교수님이 좋아하시는 스타일의 작품을 많이 만드신다. 동양화에 대한 조예가 깊지 않더라도 교수님이 지도하시는 대로 따라가면 충분히 학점을 딸 수 있다."
1269,ARDE235,종이&섬유,"문활람,구모경",2018-1학기,전공선택,3,장작가,4,4,4,4,4,4,"종이를 만드는 방법과, 섬유의 이용에 대해 배운 시간이였습니다 최고에요"
1270,ARDE235,종이&섬유,"문활람,구모경",2018-1학기,전공선택,3,secbirthday,4,3,3,4,4,4,"교수님이 중간중간 과제를 갑자기 내주셔서 당황하긴 했지만 그만큼 교수님도 학생들을 열심히 보살펴줍니다!!!

최종과제물때문에 바쁘긴 했지만 과제물이 만족스러워서 좋았네요!!"
1271,ARDE235,종이&섬유,"문활람,구모경",2018-1학기,전공선택,3,학교종댕댕댕,3,5,4,3,1,2,"성실한 학생을 좋아하십니다.
교수님 착하시지만 학점줄땐 칼같이 주시네요ㅎ
본전공생에게 더 깐깐하신듯...."
1272,ARDE235,종이&섬유,"문활람,구모경",2018-1학기,전공선택,3,김징퓽,3,5,3,4,3,3,"종이를 직접 만져보고 뜰수잇는 수업임
자기가 얼마나 하냐에 따라 결과물 나오고 교수님 친절하시자ㅣ만 학점은 칼같음"
1273,ARDE235,종이&섬유,"문활람,구모경",2018-1학기,전공선택,3,backupplease,4,5,4,5,4,4,문활람교수님...... 피하세요... 엄청 많이 시키십니다.
1274,ARDE235,종이&섬유,"문활람,구모경",2018-1학기,전공선택,3,clee,5,5,3,2,5,5,정말로 너무너무너무너무 좋았던 수업. 디조과가 아니었음에도 불구하고 정말로 교수님(특히 문활람 교수님) 두분다 굉장히 친절하시고 다 도와주십니다. 본인이 노력을 하는 모습을 보여주면 에이쁠 꼭 받으실 수 있습니다. 정말로 강추합니다!!!
1275,ARDE235,종이&섬유,"문활람,구모경",2018-1학기,전공선택,3,rhrudWkd,4,5,3,1,5,5,"비전공자이자 융합전공생으로 어쩔 수 없이 수강신청한 과목이었는데,

특히 학생 수가 적다보니 교수님이 정말 진심으로 많이 도와주셨고,

구모경 교수님께서는 작품 주제 선정부터 완성까지 하나하나 코치해주셨어요.

격려도 많이 해주시고 평상시에 좋은 말씀 많이 해주시니 수업 뿐만 아니라

인격적으로 많이 배우실 수 있을 거예요.

3월에는 동덕여대 가서 한지를 직접 떠보는 수업을 했고, 남은 3개월은 고대에서 진행했어요.

전시회도 학기중에 자주 가라고 하시고 감상문도 제출하라고 하셔서,, 조금 귀찮을 때도 있었지만

덕분에 많이 배웠네요!

비전공자임에도 불구하고 성적을 잘 받은거 보니

실력보다는 과정과 노력을 많이 봐주시는 듯 해요!

융전 과목에서 디조 과목 듣기 망설이신다면 이 과목 추천해드립니다"
1276,ARDE117,미디어와예술언어,이재준,2018-1학기,교양,3,jh1234,4,5,4,5,3,5,처음에는 학습 내용이 다소 어렵게 느껴졌지만 많은 것을 배울 수 있는 수업이었습니다.
1277,ARDE117,미디어와예술언어,이재준,2018-1학기,교양,3,ykhyung,3,5,4,4,2,2,"강의 내용이 조금 어려웠어요. 필기도 꼼꼼하게 해야해요.
중간 시험 대신 과제로 레포트 열 장 제출해야하고 기말 시험 때는 시험 문제 미리 알려주시는데 단답형이랑 논술형으로 나와요."
1278,ARDE117,미디어와예술언어,이재준,2018-1학기,교양,3,굉이,5,5,4,4,4,5,"하는 만큼 얻어가실 수 있는 수업이에요. 저는 녹음 다 해서 다 듣고 필기 다 했더니 에이포 꽉 채워서 80장 나왔어요.. ^^
대신 암기식으로 안 하시고 수업들을 때 이해하면서 들으면 흐름이 보입니다. 내용도 어려운 것 같으면서도 은근 이해하면 이해할 수 있는 정도에요.
중간 과제가 있는데 소논문처럼 쓰시면 됩니다. 저는 매우 급하게 ... 3-4일만에 써서 냈지만 논문 여러 개랑 책 여러 개 발췌하고 철학적으로 썼더니 좋게 보신 것 같아요.
수업은 중간 쉬는 시간 없이 진행돼서 좀 체력적으로 힘들었지만 교수님이 너무너무너무 좋으시고ㅠㅠ
그래서 이 교수님 수업은 다른 것도 들어보고 싶네요. 저는 이 분야에 큰 관심은 없었고 융합전공 때문에 들었지만 분야에 대한 지식을 쌓게 되어 굉장히 만족하는 강의였습니다.
내용도 많고 이해하기가 좀 어려워서인지 포기하는 학우들이 매우 많았고 그래서 그런지 상대적으로 좀만 하면 성적 매우매우 잘 주십니다. 포기하지 마세요!!"
1279,ARDE117,미디어와예술언어,이재준,2018-1학기,교양,3,pa,2,5,4,3,3,3,매우 철학적이고 추상적이며 이론적인 얘기를 다루니 실질적인 걸 기대한다면 듣지 마시고.. 이 교수님 좋아하는 학우님들도 계셨는데 개인적으로 진짜 별로..
1280,ARDE117,미디어와예술언어,이재준,2018-1학기,교양,3,Tatine,5,5,4,3,4,5,"이 강의는 처음보는 내용도 많았고 기존과는 다른, 대학에 와서, 이 강의에서만 들을 수 있는 내용을 다루고 있다고 생각된다. 그만큼 생소하고 어렵지만 수업시간에 교수님 말씀만 잘따라가고, 수업시간에 앞자리에 앉아 교수님이 나의 얼굴을 기억할 정도가 되면 자동으로 학점은 잘나올 것이다.
또한 새롭고 어려운 내용을 배운 만큼 좋은 학점을 받았을때 성취감이 있다."
1281,ARDE117,미디어와예술언어,이재준,2018-1학기,교양,3,쿠아아앙,5,5,5,5,5,5,꼭 맨 앞줄에서 열심히 들으세요. 되게 전형적인 학구적 노력파들을 좋아하시는 거 같습니다. 학점 따려고 앞에서 열심히 들었는데 나중에 되니까 열심히 듣고 있었음. 재밋어요 ㅎㅎ
1282,ARDE117,미디어와예술언어,이재준,2018-1학기,교양,3,밍흥밍,3,5,5,4,4,3,"우선 교수님께서 굉장히 인권 감수성이 떨어지십니다 굉장히 당황스러운 발언들을 많이 하십니다.
외국인 학우들에게 한국인 남자친구를 사귀면 학점 잘 받을 수 있다, 아줌마들은 근육질 남자를 좋아한다
등등 들으면서 당혹스러운 말들이 많았습니다. 저는 학습보다는 그러한 것에 더 힘들었던 것 같습니다.

학습량은 매우 많은 편이고 졸면 흐름 놓치기 딱 좋습니다. ppt를 공유해주지 않으시는 편이고
수업 내용이 굉장히 많고 교수님이 말씀을 굉장히 장황하게 하시기 때문에 전부다 필기하시는 것을 추천드립니다. 미디어와 예술언어라고 해서 미디어에 대해 배운다기 보다는 탈인간중심주의를 미학과 연결지어 배운다고 보시면 될 것 같습니다.

중간은 레포트 대체이고 기말은 시험인데 시험의 경우에는 다 알려주시나 생각해서 서술형으로 적어야 합니다.
답안을 미리 다 작성해서 수월할 것 같지만 문제가 난해한 경우도 있어서 수업을 잘 정리하는 것이 중요할 것 같습니다.

학점은 절대평가여서 잘 받았던 것 같습니다. 출석의 경우에는 크게 중요한 것 같습니다. 저의 경우에는
한번 빠졌기는 한데 A+ 받았습니다."
1283,ARDE117,미디어와예술언어,이재준,2018-1학기,교양,3,윙셋,4,5,5,5,5,5,"학점 정말 잘주십니다... 중간 대체 레포트도 정신없이 썼고 기말고사는 교수님이 예제 미리 주신 거 그냥 외워만 갔는데 A+ 받았습니당!
강의 내용 자체는 되게 어렵고 정신없이 필기하느라 바빠요. 디자인과라 미술사에 대한 전반적인 지식이 있어서 강의 진행을 따라잡는데엔 큰 어려움이 없었지만 그래서 교수님이 하고 싶은 말이 뭐지...? 하고 생각하게 만듭니다...
교수님이 한번씩 특정 학과나 특정 학생을 두고 헛소리도 몇 번 하는데요 그것만 감수하면 나름 감명깊은 수업이었습니다. 인간중심적 관점에서 벗어나 세상을 보는 시선을 환기하는데 정말 이 쪽에 관심이 많다면 명강이지만 그렇지 않다면 후회하실 것 같습니다. 미디어, 예술, 철학 등을 심도깊게 공부하겠다는 생각이 없다면 정말정말 비추입니다. 저는 그런 분야에 관심이 많아서 재미있었어용"
1284,ARDE117,미디어와예술언어,이재준,2018-1학기,교양,3,밍밍굴,4,5,5,4,4,5,"성취감은 높습니다. 굉장히 어려운 내용이지만 흐름을 파악하면 최종적으로 어떤 이야기를 하시려는지가 보입니다. 시험문제도 미리 알려주시지만 강의자료를 주시는게 아니라서 녹음을 하거나 필기를 굉장히 빡세게 해야 합니다. 개인적으로 레포트도 저번 학기에 들은 친구들의 레포트를 보고 시작하는게 흐름 잡는데에 좋은 것 같습니다.
대신 수업 초반에 학생들에게 불편한 이야기를 하십니다... 아줌마들이 근육질을 좋아한다거나 외국인 여학생 보고 남자친구를 사귀어서 족보를 얻어내라고 하시거나..."
1285,ARDE117,미디어와예술언어,이재준,2018-1학기,교양,3,닉네임할게없다,2,5,5,3,1,3,"수업내용이 좀 어렵고, 마지막에 레포트쓰느라 힘들었어요..."
1286,ARDE117,미디어와예술언어,이재준,2018-1학기,교양,3,비티05,3,5,5,3,4,3,"많은 내용을 담은 수업이라 어떤 면에선 재미있었지만 한편으로 또 어려워었고

어떻게 공부하느냐에 따라 성취감도 다르지만

나름 들어볼만한 수업이었어요"
