,과목코드,강의이름,교수이름,학기구분,이수구분,학점,사용자이름,총평,출석체크,난이도,학습량,학점,성취감,강의평
0,BNCS311,뇌및인지과학개론(영강),Christian,2019-2학기,전공필수,3,에프act폭격기,5,2,1,1,4,5,"뇌및인지과학융합전공 들으시는 분들은 꼭 들으세요.

출석은 처음에 한번 하시고 마지막 즈음부터 3번 매번 하시는데 이때 꼭 가셔야 합니다.(아마 이렇게 썼으니 교수님 귀에 들어간다면 또 랜덤으로 바뀔지도 모르겠네요) 한번 출석 할때마다 추가점수 2.5점씩 들어가는데 이게 마지막 최종 점수에서 A냐 A+이 되느냐를 가릅니다.

난이도는 쉽고 시험이 없기 때문에 학습량은 매우 적습니다. 시험 대신 시험기간 시작 직전 일요일 자정까지 제출하는 레포트가 두 번 있습니다. 각 레포트마다 무엇을 몇 단어씩 써야하는지 미리 다 알려주시니 이에 맞게 쓰시면 됩니다. 사실상 오픈북 서술형 시험이나 다름없습니다. 두 번 모두 내용과 영어 표현(문법 등)에 대해 점수를 매기시는데 중간 레포트에서는 내용만 실제 점수에 들어가고 표현에 대한 점수는 실제 점수에 들어가진 않고 기말 레포트에 반영할 수 있도록 점수만 알려주십니다. 참고자료는 마지막에 목록만 적는 것은 물론 각 인용한 부분 뒤에 괄호로 (저자, 발행년도, 페이지) 식으로 일일이 표시해줘야 합니다.

중간고사 기간의 레포트 주제는 brain imaging/modulation에 대한 레포트입니다. fMRI, EEG, TMS의 세 가지 기법 중에서 무엇을 써야할지 사람마다 하나씩 미리 골라주시는데 그것에 대해 쓰면 됩니다.

기말고사 기간의 레포트 주제는 수업시간에 다룬 감각 중에서 하나를 골라 이에 대해 씁니다. vision, audition, touch, olfaction의 네 가지 선택지가 있었고, 이번에는 중간 레포트와 다르게 본인이 원하는 감각을 택하면 됩니다.

팁을 드리자면, 수업시간에 나오는 내용을 외울 필요는 없지만 어쨌든 귀기울여 들으시길 권합니다. 레포트 작성 기간이 시험기간 중이라 각 주제가 뭔지 처음부터 읽는 것보다 미리 어느정도 알고 조사에 들어가는게 편하기 때문입니다. 그리고, 다들 아시겠지만 인터넷 자료를 인용하는 것보다 논문이나 서적을 인용하는게 훨씬 좋습니다. 이 수업에서 논문 찾는 법을 조금이나마 배운게 가장 큰 것 같네요.

학점은 잘 주시는 편입니다. 반영비율은 중간 레포트 30, 기말 레포트 60 (내용이 42, 표현이 18), 출석이 10(매 출석마다 2.5) 입니다. 모두 더하면 110인데 이번 학기 기준으로 A+은 100 이상에게 부여됐습니다. A는 85 이상에게 부여됐으니 A 받기는 매우 쉬운 반면 A+은 출석도 매번 하고 레포트도 최선을 다해 표현까지 완벽하게 써야 아쉬움이 없을 것입니다.

이하는 교수님의 final grade 이메일 일부입니다.

Dear student,
Your scores are as follows:

Midterm Contents(up to 40% of total grade): 35%
Final Contents(=up to 42% of total grade): 42.0%, Final Language(=up to 18%
of total grade): 18.0%
Attendance(=up to 10% bonus, each attendance 2.5%): 10.0%

Total Score: 105.0% = A+
(Score brackets: A+ >=100; A >=85; B+ >=75; B >=65; C+ >=55; C >=45)

뇌 및 인지과학의 기초적인 내용은 물론, 영어 레포트 쓰기, 논문 읽기, 자료 조사 등 많은 것을 배울 수 있어 성취감은 매우 높았습니다. 교수님의 말씀대로 ""레포트 쓰는게 짜증나겠지만 레포트를 쓰면 그 내용 하나씩은 다들 오랫동안 기억할거다.""가 맞더군요."
1,BNCS311,뇌및인지과학개론(영강),Christian,2019-2학기,전공필수,3,동그나비,5,2,1,1,5,5,"좋아요!
시험 같은 걸 보면 시험 치고 난 뒤 다 까먹는다는 교수님 교육철학으로
중간 기말 글쓰기 과제가 나옵니다.
덕분에 수업은 자유롭게 들을 수 있어요.
시험에 대한 부담이 없는 덕분에 더 재밌게 수업 들을 수 있었습니다.
출석체크는 한 학기 전체 통들어서 몇번만 하는데 그걸 채우면 아마 플러스 점수가 갈거에요.
그리고 글쓰기 과제는 내용과 언어능력에 대해 평가합니다.
정성들여 쓰면 좋은 점수가 나올 거에요
이 강의 추천합니다."
2,BNCS311,뇌및인지과학개론(영강),Christian,2019-2학기,전공필수,3,딩가딩가딩,5,1,4,1,5,3,"학점을 잘주시는것 같다. 교수님께서 매우 친절하신데 조금 바쁘신듯.
딴짓도 많이 했지만 수업을 재밌고 가볍게 들을 수 있는 몇 안되는 전공인 것 같다."
3,BNCS311,뇌및인지과학개론(영강),Christian,2019-2학기,전공필수,3,shkbis,4,2,1,1,5,1,"수업 하나도 안나가도 인터넷 검색하면서 에세이 두개쓰면 에이는 챙길 수 있는 과목입니다.. 대신 교수님이 영어 문법같은것도 이상하게 많이 보시니 영어가 많이 부족하면 비추입니다
출석은 전학기 세번 한거같은게 이걸 다빠지게 되면 에이쁠은 불가능합니다!"
4,BNCS311,뇌및인지과학개론(영강),Christian,2019-2학기,전공필수,3,SY12,4,2,4,2,4,3,"영어수업이다보니 수업듣기가 조금 어렵긴 했어요.. 중간기말 모두 레포트 대체다보니 큰 부담은 안됐는데 수업에서 얻어가는 거엔 한계가 있더라고요ㅠㅠ

출첵 딱 3번 하셨는데 이때만 잘 나오면 출석 가산점주셔서 학점 잘 받는 데 도움될 거에용"
5,BNCS311,뇌및인지과학개론(영강),Christian,2019-2학기,전공필수,3,dhejjd,5,2,1,1,5,3,출석체크 거의 안하시고 레포트만 잘 쓰면 점수 잘 주십니다
6,BNCS311,뇌및인지과학개론(영강),Christian,2019-2학기,전공필수,3,김정환,5,1,3,3,5,3,"쭉 영어로 이루지는 수업이라서 조금 내용 이해하는데 어려움은 있었어요.
그런데 시험을 안보고 중간고사 기말고사를 레포트로 대체하는 것은 정말 좋습니다.
저는 그 레포트를 작성하는 것부터 많이 힘들었지만..
뭔가 시험을 위한 공부보다 그냥 자발적으로 공부하게 되는 것 같습니다.
그리고 무엇보다 학점을.. 말도 안되게 잘 주세요.
저는 전혀 예상치 못한 높은 학점을 받았습니다.
그리고 교수님도 워낙 착하시고 강의력도 좋으십니다."
7,BNCS311,뇌및인지과학개론(영강),Christian,2019-2학기,전공필수,3,agnyte21,5,2,2,4,5,4,exams are at home essays. checked attendance maybe 3 times. overall not too hard but still interesting class.
8,BNCS311,뇌및인지과학개론(영강),Christian,2019-2학기,전공필수,3,고당도감귤,3,1,3,3,3,3,시험이 없는 터라 집중해서 강의를 듣기가 쉽지 않지만 강의 내용은 많습니다 재미있게 들을 수 있으면 좋은 강의라 생각합니다
9,BNCS311,뇌및인지과학개론(영강),Christian,2019-2학기,전공필수,3,A B C,5,1,3,1,4,5,"말이 필요할까요

한학기에 출석체크 3번하는데 이거 다 나오면 A+ 안나오면 A입니다

시험 없고 중간기말레포트도 어렵지 않고 부담 안됩니다

꼭 들으세요"
10,BNCS311,뇌및인지과학개론(영강),Christian,2019-2학기,전공필수,3,하회탈,5,1,3,1,5,5,"수업은 뇌과학, 그리고 인지과학의 전반을 다루는 내용입니다. 만약에 이 내용들을 전부 시험으로 봤다면.. 감당하기 힘들었을 겁니다. 하지만 Wallaven 교수님은 그런 식의 평가보다는 직접 학생들에게 어떤 주제를 주고 paper를 쓰게 하는 것으로 시험을 대체하십니다. 따라서 수업은 모든 것을 필기하기보다는 그냥 관심을 가지고 열심히 듣는 것으로 충분합니다.

교수님께서 paper의 구조를 짜서 제시해주시기 때문에 이에 맞추어서 충실히 작성하신다면 좋은 점수를 받으실 수 있고, 아마 본인에게도 매우 좋은 경험이 될 것이라고 생각합니다."
11,BNCS311,뇌및인지과학개론(영강),Christian,2019-2학기,전공필수,3,9797,5,2,2,1,4,3,일단 시험이 없고 중간기말 레폿으로 대체되는데 분량이랑 주제 거의 정해주세요. 평가는 내용적인 부분이랑 언어적인 부분을 나눠서 점수를 매기시고 총합해서 학점주십니다. 수업내용 전혀 상관없어서 갈수록 학생들이 적어지는데 가끔씩 출첵해서 보너스점수로 추가해주세요. 교수님 엄청 나이스하십니다!
12,BNCS311,뇌및인지과학개론(영강),Christian,2019-2학기,전공필수,3,보리건빵,4,2,3,2,4,3,"출석 체크를 안 하고, 시험도 없기 때문에 출석을 안 하게 되는 수업이었습니다. 그런데 명강이기 때문에 갈 때마다 많은 것을 배우고 오는 느낌이 듭니다. 출첵은 마지막 4 수업 정도에서 하시는데 언제 하실지 모르기 때문에 수업 막바지에는 웬만하면 출석하시는 게 좋습니다. 결석이라고 점수가 깎이는 게 아니라 출석하면 보너스입니다. 그런데 성적을 산출할 때 20점?10점? 단위로 절대평가를 하기 때문에, 출첵 한번에 2.5점인데 한번이라도 빠지면 2.5점을 못 받아서 출석했던 것들이 무의미하게 됩니다. 중간 과제는 뇌를 측정하는 기계 중 하나가 랜덤으로 배정되어 레포트를 쓰는 것이고, 기말 과제는 감각 중 하나를 본인이 선택하여 쓰면 됩니다. 중요한 포인트는 이해하지 못한 채로 논문을 베끼거나 말만 조금 바꾸면 교수님이 바로 알아채시기 때문에 100% 이해한 것에 대해서 본인의 말로 써야한다는 것입니다."
13,BNCS311,뇌및인지과학개론(영강),Christian,2019-2학기,전공필수,3,comtoo,3,2,1,1,4,3,"외국인 교수님이라 출첵을 거의 안했으나 그래서 안오는 사람들이 많아지자
막판에 두세번 출첵하셨는데 보너스포인트로 알고있음.
중간에세이는 문법은 점수 안들어가고 기말에세이는 문법+내용으로 점수들어감
시험을 안봐서 사실상 수업을 안들어도 영어로 잘쓰면 학점 잘나오는것가능.
맨날 출튀함..비쁠 ㅎ"
14,BNCS311,뇌및인지과학개론(영강),Christian,2019-2학기,전공필수,3,1164,5,3,2,3,5,4,일단 시험없이 에세이 대체라는게 매우 부담이 적었던 수업입니다 수업 내용도 매우 활용적인 내용 위주로 알려주세요 출첵도 학기중에 랜덤으로 3번 4번만 하셔서 부담은 없지만 모두 출첵하면 보너스 점수가 있기때문에 하시는 걸 추천합니다! 에세이가 구조가 어느정도 정해져있는데 양도 꽤 있고 쉬운내용만은 아니어서 주제에 관해 공부를 하면서 쓰는게 좋아요 교수님이 요구하신 조건에 만족해서 열심히 쓰기만 해도 비쁠 에이는 무조건 받을 수 있습니다!
15,BNCS311,뇌및인지과학개론(영강),Christian,2019-2학기,전공필수,3,syk991116,4,1,3,3,4,4,"시험이 없는 것이 가장 큰 장점입니다. 과제가 쉽지는 않지만, 영어로 에세이 쓰는 경험은 필수적이고 중요하다고 생각합니다. 그리고 학점을 그렇게 짜게 주시는 편이 아니라서 유익하고 도움되는 과제라고 생각합니다. 출석체크는 학기 끝나갈 쯤 연달아 했습니다! 학기 초중반에는 출석체크 하지 않습니다."
16,BNCS311,뇌및인지과학개론(영강),Christian,2019-2학기,전공필수,3,뿌셔,5,3,3,3,5,5,"뇌과학에 관심있는 분들 들으시면 좋아요
핵교 실험의 과학 들었다가 교수님 수업이나 그 외의 모든 것들이 좋았어서
뇌인지융전은 안하지만 듣고 싶어서 들었어요
강의는 뇌과학에 대해서 전반적으로 다루고
중간기말 시험은 레포트로 대체되어서 뇌이미징 기술이랑 감각에 대한 걸 적는데 어느정도 전문적인 내용을 원하시는 것 같아요
출석체크는 후반부에 많이 하셨습니다
외국인 교수님이 하시는 영강이라 외국인 학생분들도 많았는데 질문 되게 많이 하셔서 덕분에 수업 재밌게 들었습니다
꿀강+명강이에요!"
17,BNCS311,뇌및인지과학개론(영강),Christian,2019-2학기,전공필수,3,풋릇풋릇,5,2,2,3,5,4,뇌 과학 입문 답게 쉽고 재미있게 수업을 해주십니다. 독일인 교수님이시다보니 영어로만 모든 수업 진행하십니다. 평가를 레포트로 대체하는데 피드백도 꼼꼼하시고 점수도 후하게 주셔서 행복한 수업이 될 수 있을 것입니다. 출첵은 보너스인데 보너스 점수가 생각보다 커서( 절대평가!) 재밌는 수업 꼬박 꼬박 나와서 들으면 좋을것 같아요.
18,BNCS311,뇌및인지과학개론(영강),Christian,2019-2학기,전공필수,3,dghj,5,2,3,1,4,3,"출첵은 랜덤이며 거의 중간 이후에 가끔 하신 것 같음.
중간, 기말 다 페이퍼 대체라서 그 때만 잠깐 고생하면 됩니다. 페이퍼 가이드라인 정말 세세하고 피드백도 정말 꼼꼼하게 해주십니다,,, 교수님 정말 친절하세요!
수업도 듣다보면 꽤 재밌습니다~"
19,BNCS401,뇌및머신러닝입문(영강),석흥일,2019-2학기,전공필수,3,동그나비,2,3,4,4,4,4,"컴터 전공생이 아닌 입장에서 걱정이 많았고 그 걱정이 현실이 되긴 했습니다.
수업 내용 따라가기가 매우 어려웠고 수업 듣는 학생들도 많이 없었던 것 같아요
개인과제 몇가지와 팀플과제가 주어지는데
개인과제를 하면서 교재도 열심히 보고 컴퓨터 잘하는 친구들한테 물어보고 꾸역꾸역 했던 기억이 있습니다.
하지만 그렇게 하고나니 확실히 배운게 있긴 했던 것 같아요
팀플 같은 경우 머신러닝 잘하는 팀원이 있었고, 좀 적극적으로 모이고 발표도 잘하고 해서 좋은 점수 받은 것 같습니다.
힘들었지만 결국 학점 잘 나왔고 배운 것도 있긴 했어요.
그래도 교수님께 직접적으로 무언가 더 잘 배울 수 있었다면 더 좋지 않았을까 하는 아쉬움이 남는 강의였습니다."
20,BNCS401,뇌및머신러닝입문(영강),석흥일,2019-2학기,전공필수,3,kody21c,4,4,4,4,4,4,수업내용이 정말 최고입니다...... 레전드입니다
21,BNCS401,뇌및머신러닝입문(영강),석흥일,2019-2학기,전공필수,3,SJO,4,4,5,4,4,4,"AI에 대해서 배우는 강의입니다.

기초부터 천천히 알려주시긴 하지만 내용 자체가 워낙 복잡해서 학부 수준에서 그 내용을 100% 다 이해하기란 상당히 어려울거 같습니다.

이번 학기인 경우에는 중간은 개인과제, 기말은 조별과제로 대체되었습니다.

중간 과제는 교수님이 제시한 과제를 해결할 수 있는 AI 프로그램을 만드는 것이고, 기말 과제도 비슷한 과제였으나 발표까지 포함돼있었습니다.

사실 학점은 A+을 받긴했으나, 교수님이 끝까지 과제 채점 결과를 하나도 올려주시지 않으셔서 제가 뭘 잘해고 뭘 못했는지는 아직도 모릅니다.

출석체크는 나름 자주 하십니다. 학생들이 좀 없다 싶으시면 바로 부르십니다.

본인이 코딩에 대한 기본적인 베이스가 있고 코딩에 자신있다 싶으신 분들은 문제없이 좋은 학점 받아갈 수 있는 강의입니다."
22,BNCS314,생명물리학,정지채,2019-1학기,전공필수,3,오9오9,3,5,2,3,4,3,문과생은 조금 어려웟음. 하지만 문과생을 고려해서 점수를 아예 안주시는 건 아니고 교수님이 열심히 알려주심
23,BNCS314,생명물리학,정지채,2019-1학기,전공필수,3,꽥꽥,3,5,2,3,4,3,이과생한테는 쉽다. 일반적인 물리학 내용말고도 얘기해주시는 생활속 물리(?)같은 내용도 시험에 나온다.
24,BNCS314,생명물리학,정지채,2019-1학기,전공필수,3,부르르르릉,4,5,3,4,3,3,"물리를 아는 사람이 배우면 쉬울 것.
필자는 수능 과탐으로 물리를 했으나 대학 다니며 거의 잊어버려 공부하는 데 오래 걸렸음.
그때그때 복습하고 모르는 것을 질문하는 편이 공부하기 좋을 듯..
벼락치기로 공부하려 하면 머리 쥐어 뜯을 수 있음.

교수님이 중간중간에 다음 시간까지 알아오라며 내주시는 퀴즈..? 같은 문제가 있는데 그런 것들이 시험에 많이 나왔음.
계산보다는 개념 위주의 시험 문제.. 사실 계산기도 딱히 필요 없었던 것 같음."
25,BNCS314,생명물리학,정지채,2019-1학기,전공필수,3,anss,4,4,1,2,3,2,출석 체크는 교수님이 원하면 하신다. 수업 내용은 일반 물리와 비슷한 수준이어서 공부하는데 어려움은 없으나 1교시이기 때문에 출석을 채우기가 힘들다. 교수님이 수업시간에 말씀하시는 내용이 시험에 나온다.
26,BNCS314,생명물리학,정지채,2019-1학기,전공필수,3,냥냐,1,5,5,4,4,2,"문과생인데 한학기 내내 이거 때문에 스트레스 받았습니다..
그냥 물리 인강 들으며 혼자 하는게 나아요.
기술의 활용분야는 잘 알려주시는데
혼자 수식 어떻게 나오는지 설명하실 때 진짜 모두가 벙쪄있거나
그대로 따라쓰는데만 바빠요.
학생들이 질문도 잘 안해요, 왜냐면 이해한 사람이 몇 안되거든요 ㅎㅎ....."
27,BNCS314,생명물리학,정지채,2019-1학기,전공필수,3,사쩜오만점,4,5,2,3,4,2,"일반 물리학을 조금 축소한 내용으로 강의가 이루어지는 듯 합니다.
출석체크가 매우 중요해서 1교시를 빡세게 다녔고
내용은 물리를 공부했던 이과생이라면 무난하게 할 수 있습니다.
물리의 ㅁ자도 모르는 문과 학생이 많아서 이과면 상대적으로 매우 편한 것 같습니다
그치만 문제가 약간 지금껏 풀어온 깔끔한 문제는 아니어서 개인적으로 별로였고
수업에서 챕터가 끝날 때마다 리뷰를 시키시는데 (최대 5회) 그 가산점을 높이 주시지 않을까 생각합니다
앞서 본 강의평들과 제 학점에 따르면 출석체크가 학점에 매우 중요하게 작용하는 듯 합니다

물리에 자신이 있다면 쉽게 학점을 딸수 있는 강의입니다"
28,BNCS314,생명물리학,정지채,2019-1학기,전공필수,3,ttttllll,4,3,5,3,3,4,공부한 것에 비해 점수는 잘 나왔는데 점수에 비해 학점은 개인적으로 잘 나오지 않았음.
29,BNCS314,생명물리학,정지채,2019-1학기,전공필수,3,후우,3,4,3,3,4,3,"만약 일반물리를 이미 들었다면 다 아는 내용일겁니다
다만 1교시인데 한두번 빼고는 전부 출석을 하셨고 출석은 거의 9시 딱 되자마자 하며, 출석 마지막 순서 이름이 끝나고나서 들어오면 지각이 아니라 결석이에요"
30,BNCS314,생명물리학,정지채,2019-1학기,전공필수,3,zxzxrmfjs,4,4,3,4,4,3,"그냥 일반물리학및연습이랑 비슷하다. 생명물리학이라고는 했지만 그냥 말만 생명물리학일 뿐 일반물리학이랑 다를게 없다. 교수님께서 수업중에 말씀한 것들을 잘 메모하고 듣다보면 시험에 그대로 나올 것이다.
그리고 학점은 잘 주시는 편입니다."
31,BNCS314,생명물리학,정지채,2019-1학기,전공필수,3,졸업만하자,5,3,1,1,5,1,"일반물리학 1,2 내용을 고등학교수준이나 조금 이상정도로 다루십니다

일반물리학 1,2 했던 분들에게는 거저 먹는 수업입니다

발표는 하시는거 추천드려요~ 수업에 다룬 일상생활 관련내용도 시험에서 다루기때문에 들으셔야해요 근데 강조를 많이 하셔서 집중을 많이 할 필요는 없어요

교수님 정년전에 꿀빠세요~"
32,BNCS314,생명물리학,정지채,2019-1학기,전공필수,3,하양깽이,4,4,5,4,4,4,"물리에 베이스가 없는 문과생에게는 대단히 어렵습니다. 그러나 희망이 없지는 않습니다.

1. 중간 기말시험에서는 문과생에게 추가점수가 들어갑니다. 지난학기에는 문과생에게 10점씩 더 줬다고 교수님께서 말씀하셨는데, 이번에도 그랬는지는 잘 모르겠네요.
2. 1인당 최대 5번의 자발적 발표가 가능합니다. 발표 내용은 바로 전 챕터에서 다룬 내용과 조금이라도 관련이 있으면 뭐든지 가능합니다. 보통 챕터가 끝나고 다음 수업시간에 교수님이 기회를 주지만, 챕터가 끝난 직후에 발표하라고 하는 경우도 있습니다. 발표 점수는 한 번 당 2점으로, 출석을 못해서 깎이는 점수와 같습니다.
3. 교수님의 '예시'를 잘 들으세요. 예컨대 수업에서 나오는 어떤 현상이 실생활에 어떻게 이용되고 있는지에 대한 얘기를 많이 하십니다. 이런 걸 집중해서 잘 적어두세요. 시험에 서술형으로 출제됩니다. 이런 얘기가 꽤 많이 나오고, 그 얘기들 중 거의 모두가 시험에 나오기 때문에, 서술형의 비중이 굉장히 높습니다. 계산에 자신이 없다면 이런 부분에서 점수를 따야 한다는 겁니다.

만약 무조건 고학점을 받아야겠다면, 전자기학을 공부해 가세요. 고전역학 부분은 복습을 철저히 하면 노베이스로도 따라갈만 합니다. 하지만 감히 경고하는데, 전자기학 부분은 절대로 그럴 수 없을 것입니다."
33,BNCS313,뇌및의공학입문(영강),이종환,2019-1학기,전공필수,3,Lazarus,5,5,3,3,5,5,"노출첵

교수님 목소리 졸린거 빼면 수업 내용은 재밌음

수업 내용 쉬움 본인짱 취업 때문에 한달 통째로 날리고 ppt만 읽고갔는데도 평균 이상 나옴

과제도 매주 나오지만 걍 적당히 위키피디아 복붙하면 점수나옴

A받고 취업도 해서 상당히 기분좋음"
34,BNCS313,뇌및의공학입문(영강),이종환,2019-1학기,전공필수,3,DK66,2,5,4,4,3,3,"교수님 영어를 너무 못하세요...딱 그 졸리는 톤에 발음도 별로....내용이 수업 초반에는 입문인데 후반은 절대 입문이 아니고, 시험은 더더욱 입문이 아닌,,,저는 에이인데도 그렇게 느꼈네요. 심화 과제 많은데 이게 초고난이도에요. 불가능한데 왜 시키시는지 모르겠어요. 도움 받아서 겨우 했네요 저도. 아 그리고 이게 팩트인데 수업보다 유튜브 2~3개 듣는게 훨씬 더 머리에 쏙쏙 드러와요. 영어 유튜브로!"
35,BNCS313,뇌및의공학입문(영강),이종환,2019-1학기,전공필수,3,호르몽,4,1,3,4,5,5,"출석체크는 안하신다. 다만 한번씩 발표가 있다. 발표는 혼자서 그날 수업시작 전에 수업내용에 대해 조사해온것을 말하면 되는데 무척 쉽다. 긴장하지 않아도 된다. 물론 영어로 해야된다.

난이도는 중간은 진짜진짜진짜 쉽다. 기말에 공식들이 등장하면서 어려워 진다. 공식자체도 외워야되고, 그공식의 의미도 알아야 하며, 당연히 계산도 들어간다.

학습량은 중간범위는 외우기만 하면되고 관련된 강의를 들었다면 너무 쉬운데 문제는 기말범위이다. 너무어렵다. 진짜 어렵다. 어려워도 너무어렵다. 중간 별 2개 기말 별 5개

학점은 잘 주시는것 같다. 워낙 교류가 없어서 누가 얼마나 받았는지는 모르지만 기말 망했는데 A를 주신걸로 봐선 엄청 잘 챙겨주시는 분인것으로 판단된다.

성취감은 어마무시하다. 중간은 복습의 의미로 들었다면 기말부터는 진짜 새롭고 복잡하지만 신기한 것들에 대해서 배운다. 물론 이 강의를 듣는 거의 모든 학생들이 뇌인지융합과학과이기 때문에 뇌에대한 사전 지식이 있다는 전제하에 이야기 한 것이다."
36,BNCS313,뇌및의공학입문(영강),이종환,2019-1학기,전공필수,3,jsyoo61,1,1,3,3,3,1,"(저는 공대생입니다.)

총평: 전공수업이라 하기에 좀 난해함. 그냥 잡지식 느는 느낌. 고로 빡센 교양 느낌.
많이 실망함.

- 교수님 영어 못하심.(발음 좋다고 영어 잘하는거 아니에요)
- 교수님 설명 진짜 못하심
- 교수님 잘못 설명 하는 것도 많습니다.(ex: k-space(푸리에변환 이미지 버전) 설명할 때)
다르게 말하자면 교수님 본인이 강의자료 숙지가 덜 되어있습니다.

- 과제 많아요. 매주 요약 과제가 상당히 귀찮았습니다.
그래도 어떻게 보면 과제 덕에 교수님의 난해한 강의에 덜 의존했네요.

- 개인적으로 프로젝트 두번 다 쉬웠어요.
단.
쉬운걸 개념 설명을 저어엉말 난해하게 설명을 하시니
주변 문과생들 죽어나가겠구나 생각했죠.
(공대생 기준 프로젝트 둘 다 1시간정도 코딩하면 끝날 분량. 버그 잡는거 포함)
(첫 프로젝트는 Square wave를 Fourier Transform으로 근사하는 거였고요,
두번째 프로젝트는 Neural Network Algorithm에서 Gradient descent 구현하는 거였습니다.)

- 출석은 없습니다~"
