,과목코드,강의이름,교수이름,학기구분,이수구분,학점,사용자이름,총평,출석체크,난이도,학습량,학점,성취감,강의평
118,BNCS313,뇌및의공학입문(영강),석흥일,2017-2학기,전공필수,3,마감,4,5,5,5,4,5,"문과생 입장에선 따라가기 정말 힘들었던 수업입니다. 내용 자체가 굉장히 생소합니다.
교수님은 좋으십니다. 답변도 친절하시고, 어려운 부분을 쉽게 설명하시려고 노력하십니다. 시험문제도 쉽게 출제하시려고 하십니다. 학점도 잘 주시는 편입니다.
중간에 논문 3개를 요약하고, 그 중 하나를 발표해야 하는 과제가 있습니다. 요약 과제가 가장 힘들었던게 기억나네요..."
119,BNCS313,뇌및의공학입문(영강),석흥일,2017-2학기,전공필수,3,오인광,1,5,4,3,5,3,"한 학기 동안

중간 기말 고사에

논문 요약 과제가 세개

그 후엔 그중 한개를 골라 요약 발표하는 피피티과제가있습니다.

논문 내용이 생소해 과제자체는 굉장히 빡셌던것으로 기억합니다.

내용이 조금 어려운데 비해 시험은 굉장히 기본적인내용만 출제되구

교수님 강의력또한 정말 좋으십니다.

특정진도 이후엔 삼주정도 수강생들의 발표로만 수업이 진행됩니다.

이때 수강생들은 자신의발표가아닐때도 다른팀들의 발표시 피드백종이를 작성해야합니다.

학점은 정말 잘주시구요

다양한 뇌의공학 소재에대해서 배울수있어 유익했던 수업입니다."
120,BNCS313,뇌및의공학입문(영강),석흥일,2017-2학기,전공필수,3,yesmin,5,5,4,4,5,3,"의공학 기기들에 대해서 주로 배우는데 중간고사 이전에는 MR physics를 토대로 fMRI를 중점적으로 다루었고 이후에는 connectivity와 BCI에 대해 배웠습니다. fMRI 파트에서는 문과생들을 위해 벡터부터 가르쳐주실만큼 굉장히 꼼꼼하고 자세하게 가르쳐주셔서 좋았는데 중간고사 이후에는 BCI 하나만으로도 1학기를 배운다는데, 너무 광범위한 주제를 3~4주 단위로 끊어서 배우니 너무 겉핥기식으로만 배워서 아쉬웠습니다.
중간 기말 시험 다 보고 과제로 논문 3개를 요약, 그리고 그 중 1개 논문을 영어로 발표해야 하는 살인적인 과제량이지만 (심지어 요약 1개에 3점 정도의 비중.. 교수님이 다 채점하실 수 있을지 의문이) 생각해보면 논문 읽으면서 공부한 것이 제일 도움이 많이 되었습니다. 최신동향 읽기에도 좋고. 중간고사는 원리적인 부분만 나와서 매우 쉬웠고, 기말고사는 한 학기를 아우르는.. 대단한 1문제가 나왔지만 아는 거 아무말 대잔치 쓰고 나왔습니다.

아 그리고 교수님은 천사이십니다. 진정한 에이쁠 폭격기..."
121,BNCS313,뇌및의공학입문(영강),석흥일,2017-2학기,전공필수,3,두냥이집사,3,5,3,4,4,3,"교수님이 말씀하실때 웅얼웅얼 말씀하시는 경향이 있어서
앞 쪽에 앉는 걸 추천드립니다~

중간고사, 기말고사, 논문3개 요약, 조별발표 등 한 학기에 해야하는 것이 꽤 많습니다만
교수님이 성적은 매우매우매우 잘 챙겨주십니다.

아쉬운 점 하나는 교수님이 학생들에게 별 관심을 안 준다는 점?
수업에 힘을 별로 안 쏟는 기분이었습니다."
122,BNCS313,뇌및의공학입문(영강),석흥일,2017-2학기,전공필수,3,볼펜뉴,4,5,4,3,4,4,"문과생 입장에서의 강의평.

1. 수업 난이도
난이도는 수업시간에 집중하고 어려운 것만 복습하면 크게 따라가지 못할 정도는 아니다. Physics를 다룬다 하더라도 깊이는 안들어가니까 충분히 따라갈 만 했다. 기본 지식이 없다는 가정 하에 용어들이 초반엔 좀 어려울 수 있으나 익숙해지면 괜찮아질 것이다. MRI 응용 원리 및 Brian morphography, fMRI 원리 등 중간고사 쯤까지 배우는 내용만 따라가면 이후로는 그래도 수월해진다.

2. 과제
논문요약하는 과제가 1주에 한번씩 세 번 주어진다. 크게 어렵진 않아도 성가실 수는 있다. 논문 스키밍하는 실력이 갈수록 늘어가는 것을 느낄 수 있다. 이 후 그 중에서 하나를 골라 파트너와 함께 발표해야하는데, 논문 내용을 요약해서 발표하면 되므로 크게 어렵진 않을 것이다. (물론 모든 것을 영어로 진행해야한다.)

3. 시험
중간고사는 PPT를 위주로 내용 파악을 했다면 크게 어렵지 않게 풀 수 있을 문제들이 나온다. (쉽진 않다, PPT를 그래도 꼼꼼이 외워야 한다.) 기말고사는 한 학기동안 배웠던 내용을 토대로 BCI 프로그램을 설계하라는 서술형 문제가 나왔다.

4. 학점
이 모든 것을 무난하게만 한다면(심지어 개인적으로 나는 기말고사를 잘 본 편이 아닐 게 분명함에도) 학점은 꽤 잘 나온다!"
123,BNCS313,뇌및의공학입문(영강),석흥일,2017-2학기,전공필수,3,크크크크 크크,1,5,5,4,3,3,"중간고사까지는 교수님께서 강의를 하시고 중간고사 이후에는 팀 발표를 합니다.
팀발표하기 전에 뇌영상 관련 논문을 3편 읽고 요약해야합니다.
팀발표는 요약한 논문을 발표하는 것입니다.
다른 분들은 어떠셨을지 잘 모르겠지만 논문을 읽고 이해하기가 너무 어려웠습니다.
다른 분들이 발표하시는 내용도 알아듣기 어려웠어요."
124,BNCS313,뇌및의공학입문(영강),석흥일,2017-2학기,전공필수,3,뚜둔뚜둔뚜,3,5,3,4,5,2,"일단 할게 정말 많습니다.
중간고사 이후 3주간 매주 1500~2000단어 분량으로 영어 논문 요약해서 올려야 하고
그 중 하나 골라서 팀 발표도 있어요.

그런데 하기만 하면 학점은 저어어어어어어어엉말 잘 주시는 것 같습니다.
중간고사는 정말 쉽게 내시고 수업시간에 이런게 나올 수 있다 말씀하신거 그대로 내십니다.
기말고사는 한 문제인데 fMRI와 BCI를 이용해서 자기만의 system을 설계하라는 문제를 내셨는데 이 과정에서 조건이 많았어요. 무슨 손으로 하는 output이 나와야하고 어쩌구..

사전에 메일로 own system을 design하는 문제로 한 문제만 나온대서 기말 범위 피피티 한 번도 안 읽어보고 eeg로 준비해서 들어갔다가 시험문제 보고 뭔소린지 하나도 모르겠어서 아 재수강이구나 싶었는데 A 받았네요. 논문 요약도 엄청 대충했는데 제출에 의의를 두시는 것 같습니다."
125,BNCS313,뇌및의공학입문(영강),석흥일,2017-2학기,전공필수,3,LIM,4,5,3,3,5,4,"뇌공학을 주로 다루는 수업이다.
새로운 내용을 배운게 많지만, 교수님이 조근조근 말씀하셔서 뒤에까지 목소리가 잘 전달되지 않아 놓친 부분이 꽤 있었다. (앞에 앉는 것을 추천합니다) 그래도 슬라이드가 잘 설명해주어 수업을 듣기만 했다면 나중에 따라가는데에 크게 지장은 없는 것 같다.

과제는 3주동안 주1회 논문 요약을 하는데, 논문 선정도 본인이 할 수 있고 크게 제약을 걸어두지 않으셔서 큰 부담은 안 느껴진다. (다만 논문과 친숙하지 않으면 조금 힘들지도..)

기간도 가끔 무슨 문제가 있다면 쉽게 연장해주시고 (중간고사 다음날이었습니다) 학생들의 의견도 잘 반영해주셔서 융통성있는 수업이었다고 생각된다.

중간기말도 교수님이 미리 수업시간에 힌트를 주셔서 공부하기도 쉽지만, 전반적으로 내용을 한 번 다 보면 훨씬 수월할 것 같다."
126,BNCS313,뇌및의공학입문(영강),석흥일,2017-2학기,전공필수,3,됴로로로롤,4,5,3,4,4,3,"중간고사, 기말고사, 논문 요약 3번, 발표 1번 있습니다.
출석은 매번 체크하시는데 6교시라 큰 부담은 없습니다. 수업을 열심히 듣는지의 여부는 학점에 크게 영향을 주는 것 같지는 않습니다.
중간고사는 문제 거의 알려주시고 정말 기본적인 개념에 대한 것만 물어보십니다. 저도 클루평에서 보고 안건데
MRI 부분은 MRI made easy 참고하시면 좋습니다. 구글링하시면 나옵니다. 기말고사는 1문제이고 그 학기동안 배웠던 내용들을 전반적으로 숙지하고 가시는 게 좋을 것 같습니다 (중간고사 범위 포함).
논문 요약이 생각보다 시간이 오래 걸려서 부담스럽기는 하지만 배점이 크지 않아서 적당히 하셔도 될 것 같습니다. 논문은 다른 주제의 논문 3개를 골라서 요약합니다. 발표는 교수님 평가+다른 학생들 평가로 점수가 매겨집니다. 2인 1조고, 조원과 발표 순서는 랜덤으로 정해집니다. 요약했던 3개 논문 중 하나를 가지고 발표를 하는 거라 발표를 할 논문은 조원과 연관된 주제로 골라야합니다. 그래서 각자 고른 연관된 주제의 논문 2개를 15분 동안 발표합니다. 논문 요약을 하고 발표 준비를 하다보면 이 강의가 클루평이 좋은 이유가 뭘까 도대체 학점을 얼마나 잘 주시길래 그런걸까 하는 마음이 생깁니다. 근데 정말 그만큼 학점 잘 주십니다. 진짜 재수강 걱정하고 있었는데 A 받았습니다.
교수님도 나긋나긋하게 수업하시고 좋으십니다. 관심을 가지고 열심히 들으면 이쪽 분야에 대한 기본적인 지식들을 얻어갈 수 있을 것 같습니다. 하지만 그렇지 못해도 좋은 학점은 얻어가실 수 있습니다."
127,BNCS313,뇌및의공학입문(영강),석흥일,2017-2학기,전공필수,3,칸쵸 마시써,2,5,3,4,4,4,"중간고사 매우 쉽고 (자세히 안 외워도 됨), 논문 요약 1500~2000자 3개, 팀플 발표, 기말 있음.
기말은 한 문젠데 답이 정해져 있는 게 아니라서 강의 내용 공부해도 내가 답안지에 무엇을 쓴 건지 잘 모르겠음.
다음에 들으실 분들 논문 잘 고르세요... 쉽고 짧은 걸로 이거 때문에 고생함"
128,BNCS313,뇌및의공학입문(영강),석흥일,2017-2학기,전공필수,3,규순이,4,5,5,2,4,3,"진짜 컨텐츠 수업질 내용 성취감 전부 다 좋으나

100퍼 영강으로 진행되서 따라가기 힘듭니다 토익 900 토플 85 인데도 못 따라가겠어요 생소한 단어가 너무 많아서 ㅠㅠ

중간은 크게 5문제

기말은 fmri based brain model 1문제 내십니다"
129,BNCS313,뇌및의공학입문(영강),석흥일,2017-2학기,전공필수,3,bellcow96,4,5,3,3,4,4,"주로 뇌 연구에 사용되는 장비들의 기본적인 원리를 배웁니다. 이번 학기에 다룬 내용은 MRI, fMRI, EEG입니다. Brain Connectivity와 Brain Disease Diagnosis에 대한 것도 간단하게 다루었구요. 교재는 따로 없고 거의 PPT로 수업합니다. 시험도 필기 + PPT에서 다 나옵니다. 중간고사는 시험 범위에서 정말 핵심적인 부분에서 나왔고 (이미지를 보고 T1 weighted인지 T2 weighted인지 판별, BOLD 신호의 원리 등) 기말고사는 조금 넓게, fMRI를 이용한 자기만의 BCI 시스템을 설계해보라는 문제가 나왔습니다. 너무 깊게 들어가지는 않기 때문에 수업만 열심히 들으면 공부할 양은 그렇게 많지 않습니다."
130,BNCS311,뇌및인지과학개론(영강),Christian,2017-1학기,전공필수,3,iendoa,4,4,3,3,4,2,"학습량은 하기 나름인 수업입니다. 전 수업 잘 안들었고 그냥 중간기말 대체 레포트 열심히 써서 좋은 학점 받았습니다.
아마 관심이 있는 분들은 학습량이 많겠죠? 전 관심이없어서 학습을 안했어요"
131,BNCS311,뇌및인지과학개론(영강),Christian,2017-1학기,전공필수,3,학생회좋은분,5,3,2,2,5,4,"뇌인지 쪽에 관심이 있다면 흥미있을만한 수업 주제,
선한 교수님, 퍼주시는 학점.
들으세요!"
132,BNCS311,뇌및인지과학개론(영강),Christian,2017-1학기,전공필수,3,스페이스,4,2,3,3,5,2,"레포트 두번으로 성적이 결정되고 주제도 수업 내용과 직결되지 않다보니
솔직히 딴짓을 할때도 종종 있었어요..... 죄송합니다 교수님..ㅠㅠ
성적은 기대대로 매우 잘 받았구요.
뇌과학 한바퀴 쫘악 다뤄주셔서 개인적으로 좋았습니다"
133,BNCS311,뇌및인지과학개론(영강),Christian,2017-1학기,전공필수,3,alalalk,4,2,3,3,4,4,"평소 수업은 영강인데, 어렵거나 매우 전문적인 것은 아니라서 들을 만 한 것 같습니다.
개론이니까 약간 들어두면 좋은 교양느낌? 각 분야에 대해 흥미를 불러 일으키는 것 같습니다..
시험?은 중간, 기말 레포트로 대체하는데 저는 기말만 열심히 했습니다. 확실히 레포트를 쓰면서 조사하면 그 분야에 대한 흥미도 높아지고 나중에 유사과목에서 뭔가 이미 조사했던 것이라서 배울 때 더 흥미롭게 배울 수 있습니다.
사실 수업을 영어라 졸아서 잘 안 듣긴했지만 그래도 부담감 없이 들으면 좋을 듯 합니다.
학점은 열심히 쓰면 잘 주십니다."
134,BNCS311,뇌및인지과학개론(영강),Christian,2017-1학기,전공필수,3,rllq,5,1,3,3,4,4,출석은 거의 안합니다. 빠져도 점수 깎이는 게 아니라 출석하면 점수를 주는 식입니다. 시험도 없고 에세이로 대체합니다. 그래서 수업에 집중하지 않게 되지만 에세이 쓸 때 도움되니 듣는 것도 좋아요. 주제랑 들어가야 할 내용은 다 알려줘서 쓰기 어렵지 않은 것 같습니다. 다른 건 몰라도 에세이 쓴 거에 대해서는 잘 알게 돼서 좋아요!
135,BNCS311,뇌및인지과학개론(영강),Christian,2017-1학기,전공필수,3,됴로로로롤,5,3,3,3,5,3,"교수님이 좋으시고 수업 내용도 흥미로웠습니다. 시험을 안보고 중간기말 모두 레포트로 대체하기 때문에 크게 부담이 되지도 않는 거 같아요.
출석체크 방식은 학생들에게 설문조사를 하셔서 거기서 나온 결과대로 진행하시는 거 같은데 이번 학기에는 랜덤으로 출석체크하고 출석한 사람들한테 가산점 주는 방식으로 하셨어요!
중간 대체 레포트는 주제가 랜덤이었고 기말 대체는 주제를 선택할 수 있었던 대신에 분량이 더 길었어요. 평가는 내용이랑 문법을 보시는데 문법 점수는 중간 때는 안들어가고 기말에만 들어갔어요. 열심히 쓰면 점수는 잘 주시는 것 같습니다."
136,BNCS311,뇌및인지과학개론(영강),Christian,2017-1학기,전공필수,3,TheRim,5,2,2,2,5,3,"수업은 전반적으로 인지과학을 세부 주제별로 나누어서 훑는 스타일로 진행됩니다. 교수님이 최신 연구들을 많이 소개해 주시려고 노력하는 편이셔서 흥미롭게 들을 수 있습니다. 평가는 중간고사 에세이 하나와 기말고사 에세이 하나로 진행됩니다. 에세이 주제들과 수업 내용이 연관되는 부분이 좀 적어서 성적만 받으려면 수업은 거의 안 들어도 되는 것 같지만, 교수님이 열정 넘치시고 내용도 흥미로워서 그냥 잘 듣게 되는 것 같습니다. 학점은 매우 잘 주시는 것 같습니다."
137,BNCS311,뇌및인지과학개론(영강),Christian,2017-1학기,전공필수,3,와송,4,2,3,3,5,4,"중간과제, 기말과제, 출석은 없고 오면 보너스 점수(투표로 결정)!

수업은 재밌습니당"
138,BNCS311,뇌및인지과학개론(영강),Christian,2017-1학기,전공필수,3,Ubermensch,5,2,3,2,5,4,"진짜 윌라븐 교수님 천사에요

수업도 완전 흥미롭구

학점도 잘주시고 ><

수업 거의 안나갔는데 넘나 죄송스러워요...

힝

레폿 조오오금만 신경쓰시면 좋은 학점 받을수잇어여"
139,BNCS311,뇌및인지과학개론(영강),Christian,2017-1학기,전공필수,3,에이플폭격기,5,3,1,1,5,4,"중간/기말 에세이 + 출석점수(학기초에 설문조사를 통해 어떤 식으로 출석점수를 반영할지 정하셨습니다)
여타 수업처럼 ppt를 달달 외우거나 교수님 말씀을 다 받아적어야 에이쁠 받는 수업이 아니라는 점이 오히려 수업에 더 흥미를 갖고 들을 수 있게 한다는 점이 좋았습니다. 그렇다고 해서 수업을 아예 듣지 않으면 후에 에세이 작성 때 매우 힘들 수 있으니 (사전 지식이 있다면 불가능 하지 않지만), 수업을 듣는 편이 좋습니다."
140,BNCS311,뇌및인지과학개론(영강),Christian,2017-1학기,전공필수,3,LIM,5,1,3,4,5,5,"하는만큼 얻어가는 수업입니다.
교수님은 너무 좋으시고 많은 것들을 가르쳐 주십니다.
하지만 본인이 얼마나 열심히 수업을 따라오고 따로 공부하느냐에 따라 이 강의에 대한 만족감과 성취도가 달라질 것 같습니다.

시험은 따로 없고 중간, 기말 각각 에세이 한 편씩 제출합니다. 에세이 또한 쓰면서 내용을 더 깊게 알아가는 유익한 시간이라고 느껴집니다."
141,BNCS311,뇌및인지과학개론(영강),Christian,2017-1학기,전공필수,3,이사람상태가,4,3,3,2,3,4,교수님께서 정말 전반적인 뇌 관련 지식을 넣어주심. 너무 많이 주시다보니 개인적으로 다 못 소화하더라도 자잘한 디테일적인 내용까지 설명해주시는 것을 보면 많은 것을 알려주시려는 느낌이 듬. 시험대신 레포트 제출 형식인데 뇌 관련 노벨상 수상 찾기가 너무 힘들었음. 찾아서 이겁니다라고 적어도 학생 그거보단 많아요~ 하는 경우가 많음. 출석은 복불복. 사람이 적다~ 싶으면 출석체크를 하는데 본인이 수업에 좀 빠졌음에도 불구 눈치로 왠지 이 날은 출석체크할거 같다 싶은 날 가면 출석체크를 함.
142,BNCS311,뇌및인지과학개론(영강),Christian,2017-1학기,전공필수,3,geniey,5,2,3,3,4,4,"첫 수업때 출석체크를 어떤 식으로 할건지 블랙보드에서 투표를 하자고 하십니다.
이번학기는 출석체크를 할 때마다 보너스 점수를 주는 방식으로 진행했습니다.

수업은 교수님의 PPT 위주로 100퍼센트 진행되고
중간, 기말은 에세이 대체입니다.
\에세이 구조까지 다 제시해주셔서 쓰기 쉽지만, 이 구조가 정해져있어서 어렵기도 합니다.
중간때는 별다른 말씀 없이 감사한 성적을 주셨지만, 기말때 구조에 맞춰서 쓰라고 피드백을 몇번 받았습니다.
당황했었는데 그래도 점수는 정말 잘 주셨습니다. 에세이를 제출하면 메일로 문법,내용구성 등 체크해서 성적과 함께 결과를 보내주십니다.

출석체크는 몇 번 했었던거 같은데 저는 한번 한 이후로 수업을 잘 가지 않았습니다 ㅠㅠ 출석은 성적에 별 영향이 없는것 같습니다.

정말 편한 수업입니다. 천사교수님..!"
143,BNCS314,생명물리학,정지채,2017-1학기,전공필수,3,해마,4,5,1,1,4,2,"고등학교 때 배운 물리를 배워요. 이과한테는 매우 수운 수업입니다. 중간, 기말 봤고 시험문제는 파워포인트에서 배운게 대부분이지만 중간중간 수업중에 이야기 하신 것도 나와요."
144,BNCS314,생명물리학,정지채,2017-1학기,전공필수,3,우어아앙,5,4,3,4,4,3,"전자기 파트 때문에 신청했는데 생각보다 꽤 괜찮았습니다.
다른 물리 교수님들과는 조금 다른 접근법도 흥미로운 점도 있었고요

근데 물리를 처음 들으신다면 한 학기에 대학 물리 대부분을 끝내기 때문에 조금 벅찰 수도 있습니다. 그럼에도 불구하고 교수님께서 배려를 많이 해주셔서
문제 자체는 막 전공같이 출제되진 않아요.

출첵을 자주하시다가 학기 후반 가면 뜸해지고요
중간 기말 다 있습니다.
아 그리고 자기가 발표할 내용을 가지고 수업시간마다
교수님이 기회를 주실 때 리뷰를 하면 가산점도 있어요.

뒷부분에는 양자역학도 한두시간 정도 다루는데 엄청 깊게 가진 않습니다.
뇌인지 융합전공 하시는 분들이 많이 들으시는 것 같은데
문과도 노력만 좀 하시면 학점도 잘 받으실 수 있을 것 같습니다."
145,BNCS314,생명물리학,정지채,2017-1학기,전공필수,3,엘사,3,5,3,3,3,3,"졸렸다.

수업을 열심히 안 들어서 딱히 할 말이 없다.

출석체크는 거의 매번 하신다."
