,과목코드,강의이름,교수이름,학기구분,이수구분,학점,사용자이름,총평,출석체크,난이도,학습량,학점,성취감,강의평
77,BNCS314,생명물리학,정지채,2018-1학기,전공필수,3,yesmin,4,4,1,1,5,4,"그냥 고등학교 물리입니다. 내신 챙겨보신 이과생들은 무난하게 공부하실 수 있는. 문과생들 중에 뇌인지를 선택하신 분들을 위한 기초강의라고 보시면 될 것 같습니다. 아주 쉬워요. 심지어 시험 중에 공식 물어보면 무슨 공식인지 칠판에 써주십니다. (여담으로, 중간고사때 한 문제가 헷갈려서 칠판에 써져있는 공식을 그대로 문제에 받아적기만 했는데도(물론 저 공식이 어떤 문제에 대한 공식인지는 알려주시지 않으시지만요) 10점중에 9점을 주셨습니다.. 답안지 확인하러 갔다가 그냥 조용히 나왔습니다.. ㅋㅋ.. 뭐지..)


출석은 자주하시는 편입니다. 랜덤이긴한데, 지각과 출석이 동일하게 까이고(?) 비중이 꽤 큽니다.(한번에 2점)
발표를 하면 추가점수를 주시기 때문에 이러한 출석점수나 중간 기말 때 점수를 만회할 수 있는 기회가 있습니다."
78,BNCS314,생명물리학,정지채,2018-1학기,전공필수,3,반도리,5,5,1,1,5,3,"출석체크 항상 하십니다. 그래도 내용은 물리1까지 하신 분이라면 시험들어가기전에 식만 조금 보고 가시면 문제없이 A+ 나올 수 있습니다.
시험문제에 한두문제정도 식 유도하고 하는게 나오기도 합니다. 이런건 틀려도 학점에 큰 문제는 없을 거에요.
한 챕터가 마치고 나면 리뷰 시간을 주십니다. 이 때 발표 한번이라도 하시는게 좋을 거 같아요. 저도 발표 한번 하고 A+ 챙겨갔어요.
교수님 수업은 꼭 들으셔야해요. 저는 흘려들으면서 놀긴 했는데, 가끔 교수님이 설명한 게 문제 그대로 나오는경우가 있어서 안 듣더라도 녹음이라도 꼭 하세요."
79,BNCS314,생명물리학,정지채,2018-1학기,전공필수,3,llllll,4,1,2,2,5,3,"고등학교 물리 복습하는 느낌
선택과목 물리 고르셨으면 어렵지않게 좋은 학점 받으실 수 있어요"
80,BNCS314,생명물리학,정지채,2018-1학기,전공필수,3,아아어엉,5,2,1,1,1,1,"너무 좋은 꿀강입니다.
뇌인지과학 하고있다면 꼭들으세요
교수님도 좋으시고
시험도 좋고
배우는 내용도 알찹니다.
교과서보다 더 많은 세상을 배울수있음"
81,BNCS314,생명물리학,정지채,2018-1학기,전공필수,3,스요오오오일,5,3,3,3,4,4,"출첵 확률 70퍼
과제있지만 검사하지 않음"
82,BNCS314,생명물리학,정지채,2018-1학기,전공필수,3,groeeen,4,5,3,3,3,3,"1교시 출석 정말 9시 땡하면 하십니다 출석 하시는 도중에 자기 이름이 먼저 앞에 불려서 나중에 다시 말씀드려도 교수님은 굉장히 단호하십니다..

수업은 솔직히 이공계 학생으로써 일물을 새내기때 들었기에 새로운 내용은 없었으나 복습하는 기분이여서 좋았습니다. 문과 분들도 잘 따라갈 수 있게 찬찬히 설명 해주십니다. 공수 내용의 간단한 정도도 문과/공수를 안하시는 다른 이공계 분들이 많아 계산 자체를 학생들에게 할 줄 알라고 요구하시지 않습니다.

그냥 1교시 출첵의 지옥만 견디면 한 학기 보람차게 보낼 수 있습니다.
한 챕터가 끝나면 강의 요약 발표를 volunteer 받아 할 수 있고 그에 따른 가산점을 부가해 주시는데, 뭐 꼭 발표 안해도 시험만 잘 보면 학점은 잘 주시는 것 같습니다."
83,BNCS314,생명물리학,정지채,2018-1학기,전공필수,3,LuckyTiger,3,4,4,4,4,3,"출석체크는 랜덤으로 하시는데 보통 거의다 하신다고 보면 됩니다. 아침9시 정각에 출석체크를 하시고 3초라도 늦으면 지각체크도 없고 바로 결석처리 됩니다.

물리1, 물리2, 미적분학및연습을 듣고 오시지 않으면 수식이라든지 내용이 이해하기 힘들 수도 있습니다. 하지만 교수님이 다 설명해주시고 시험도 많이 어렵게 나오지는 않기 때문에 크게 힘들지 않습니다.

학점은 잘 주시는 편 같습니다."
84,BNCS314,생명물리학,정지채,2018-1학기,전공필수,3,고대고대고대고대,3,4,4,4,4,3,우선 출석같은 경우 교수님이 부르시는 날도 있고 부르지 않는 날도 있는데 지각체크는 하시지 않으시고 자기 이름 부를때 없으면 무조건 결석입니다. 1교시라서 가시기 힘드실 수도 있어요.. 그리고 이 출석과는 별개로 교안에 있는 내용 외에 교수님이 수업시간에 예를 들어주시는 것이나 내용도 시험에 그대로 내시기 때문에 결석하시면 따라가기 힘듭니다. 이름만 생명물리학이지 내용은 일반물리학과 동일하며 교수님 수업이 좀 지루하실 수 있습니다. 학점은 잘. 주시는 편이신 것 같고 식이 어떻게 나왔는지 과정과 문제를 모델링하는 과정을 중요시 여기십니다.
85,BNCS314,생명물리학,정지채,2018-1학기,전공필수,3,TheRim,3,4,3,3,3,3,"물리 배우신 이과에게는 전혀 어려울 것 없고, 문과에게는 좀 벅찬 강의일 수도 있을 것 같습니다. (물리 안배운 이과는 주변에 없어서 모르겠습니다) 교수님이 약간 학생들이 이미 내용을 다 안다고 생각하고 강의하시는 스타일이십니다"
86,BNCS314,생명물리학,정지채,2018-1학기,전공필수,3,니나노,4,5,2,3,4,2,"학점 잘 주시는 편이고 출석체크는 매시간 정각 되자마자 하십니다
이과생이시면 무난하게 들으실 수 있습니다 고등학교 물리정도인듯해요"
87,BNCS314,생명물리학,정지채,2018-1학기,전공필수,3,고대14,4,4,4,3,4,2,"물리학을 배워본 적이 없어서 매우 힘들었습니다. 근데 교수님께 학생들을 많이 배려해주셔서 괜찮았어요.
출첵은 거의 항상 하셨고 수업 시작하자마자 하십니다.
점수를 잘 주시는 편"
88,BNCS314,생명물리학,정지채,2018-1학기,전공필수,3,하스매니아,5,5,3,4,5,4,"출석체크 매일 하십니다.

중간고사 기말고사 두번만으로 평가하는데,
공식들은 시험중에 질문하면 칠판에 적어주시기 때문에 암기보다는 이해가 중요했습니다.

만족합니다"
89,BNCS314,생명물리학,정지채,2018-1학기,전공필수,3,호르몽,4,4,2,1,5,4,"난이도는 물포자, 물알못이 들었을때 별 4개고, 물리선택했던 사람이라면 별 1개정도로 굉장히 쉬운편 입니다. 강의를 잘 해 주시고, 시험도 엄청나게 쉽습니다. 심지어 시험시간에 공식 모르는걸 다 알려 주십니다!!! 물린데 ㅎㅎ. 주로 정답을 숫자로 구하는것 보다는 수식을 통해 이해하는 것을 추구하시는 분이고, 강의력은 평균보다는 잘 가르쳐 주시는데, 과목특성상 이해 못하시는 분들은 힘드실 겁니다.(저요... 근데 A ㅎㅎ) 수업시간에 안 졸고 잘 들으면 A는 확정입니다. (근데 1교시,,,) 출첵은 한 4번정도 안하시고 다 하셨습니다. 주의할 점은 지각=결석 이고 출석부를때 들어와도 이미 자기 이름이 불렸으면 결석처리 됩니다. 이유는 9시가 넘었기 때문에.... 학점은 굉장히 잘 주시는것 같습니다."
90,BNCS314,생명물리학,정지채,2018-1학기,전공필수,3,이오2,3,5,2,1,5,1,"의외로 학점을 잘 받아서 신기한데, 시험을 아주 잘 본 것도 아닌 것 같고 공부 자체도 일반물리 배웠고 물12 했던 걸로 우려먹었습니다. 솔직히 수업 내용 중에 틀리거나 본질적이지 않은 내용이 많아서 저는 진짜 싫었습니다. 그래서 때려치고 나가고 싶었지만 출석을 매일 하시고 연세가 있으신 교수님이며, 사람 수도 섭시간엔 적어서 감히 나갈 수는 없었습니다. 발표 하시면 가산점 있다고 합니다. 그냥 문제풀이 발표하면 한마디 하십니다. 그래도 학점을 잘 주셨기 때문에 총평은 보통입니다.. 개인적으로 수업을 듣기 싫은데 해야해서 제일 힘들었습니다. 그리고 매우매우 작은 목소리로 출석을 부르시는 건 지금도 기억에 남네요 ㅋㅋ.. 아, ppt 가독성이 떨어지니까 그냥 물2 책이나 일반물리 책 보고 공부하시고 따로 말씀해 주시는 게 시험에 나올 수 있으니까 일반물리 이상을 공부하신 게 아니라면 수업 듣긴 들으셔야 해요."
91,BNCS314,생명물리학,정지채,2018-1학기,전공필수,3,오호라으읭,4,5,4,4,4,3,"생명물리학이지만 사실 물리를 배우는 강의입니다.
교재는 교수님의 PPT로 진행됩니다.
출석은 정말 칼같이 9시 땡치면 하시고, 지각은 받아주시지 않습니다.

난이도는 사실 수업시간에 배울때는 그렇게 어렵지 않았는데
시험의 난이도가 공부하는 것과 다르게 어려웠던 것 같습니다.
수업을 꼭 잘들으셔야지만 시험준비를 무난하게 하실 수 있습니다.
하지만, 시험이 어려워서인지 교수님이 천사이신지 점수에 비하면 정말 과한 학점을 받았습니다~"
92,BNCS314,생명물리학,정지채,2018-1학기,전공필수,3,josephine,3,5,5,4,4,3,"저..는 문과인데요...

사실... 이해를 잘 못했어요...

다른 친구들한테 물어보면 고등학교 물리 수준이라는데..
저는 그정도도 안되나봐요... ㅎㅎ..ㅎ...

일단 물리 기초가 없는 분이면 좀 어려우실 수 있어요.
그냥 추상적으로 이런 현상이 있다! 이런게 아니라 수식으로 막 무언가를 증명하시는데
사실 뭐였는지도 모르겠어요 아직도..

출석은 매일 하시구요, 출석 부르실 때 자리에 없으면 그냥 결석입니다 ^0^
일찍일찍 가야죠... 미리미리 가는 학생이 됩시다!

교수님은 학생들 배려해주려고 하세요. 아마 질문하면 답도 잘 해주실 거에요.
저는 제가 뭘 모르는지 몰라서 질문도 못했지만...
그래도 학점 정말 잘 주시는 편입니다. 정말로!

저는 아무것도 못 알아들어도 일단 결석없이 가기는 했구요. 자리에 앉아서 듣기는 했습니다..
시험기간에도 그냥 제가 이해한 것만 공부했어요 ㅎㅎㅎㅎ 시험때 뭐라도 쓰려고 노력했구요...

그렇게 하면 어떻게든 한 학기가 끝납니다!! :)"
93,BNCS314,생명물리학,정지채,2018-1학기,전공필수,3,zmg5882,3,5,4,3,5,2,"제대로 배운게 없는 수업이었습니다. 저는 중학교 이후로 물리를 배워본 적이 없는 문과생입니다. 하지만 개인적으로 미적분,미분방정식, 푸리에변환 등을 공부해서 수리적인 부분은 이해하는데 어려움이 없었습니다. 문제는 개념 이해가 어려웠네요. 교수님이 설명하실 때 이미 학생들이 알고 있을거라고 생각하고 그냥 넘어가시는 부분들을 저는 하나도 모르니까 그 응용된 내용은 당연히 알 수 없었고 혼자 공부해야 했습니다. 물리를 진짜 공부하고 싶어서 이 수업을 들었다가 한학기 내내 스트레스만 받았습니다. 수강생 중 이공계 학생들도 많고 실제로 물리를 배웠던 분들도 계신거같은데 형평성은 부족하지만 그래도 워낙 시험이 쉽고 성적을 잘 주셔서 성적 관련하여 큰 불만은 없습니다. 시험 스타일이 일반적인 물리강의와는 매우 다릅니다. 수업시간에 교수님이 말씀하시는 응용분야에서 꽤 많이 나옵니다. 그리고 시험을 잘 못봤는데 성적을 잘 주신 것 같습니다. 한 챕터가 끝날 때마다 그 챕터와 관련해서 발표하면 가산점도 주십니다.한 번 할때마다 무려 2점씩이나 주십니다. 근데 워낙 성적을 잘주시니 발표를 안해도 어느정도 공부를 한다면 좋운 성적 받으실 수 있을 것 같네요. 저는 이번에 발표는 한번도 안했습니다. 수업 따라가는 것만으로도 너무 힘들어서;; 1교시 강의였는데 칼같이 출석체크하셔서 이것도 힘들어요... 오전 수업 힘드신 분들이라면 심각하게 고민해보시길"
94,BNCS314,생명물리학,정지채,2018-1학기,전공필수,3,Lazarus,5,5,5,5,5,5,"일반물리학 전체 내용을 한학기에 커버합니다
어려운 문제는 안나오고 개념 위주로 시험에 나와요
만점 방지용으로 회로이론, 전자기학 문제가 나오지만 못맞춰도 A+받는데 지장은 없었어요
거기에다 과제도 없어서 진심 개꿀이에요"
95,BNCS314,생명물리학,정지채,2018-1학기,전공필수,3,382659,4,4,3,3,5,4,"교수님이 친절하시고, 성적을 매기기 위한 시험 문제보다는 수업 시간 중 언급하신 응용 분야에 관한 부분이 많았습니다.
출석체크는 9시 땡 하면 부르시는데, 지각은 받아주시지 않으세요.
1교시라는 점만 빼고는 좋았던 수업입니다."
96,BNCS311,뇌및인지과학개론(영강),Christian,2017-2학기,전공필수,3,여치랑놀자,5,1,4,3,5,3,"강의 자체는 굉장히 프리하고, 시험도 없고, 출석체크도 없습니다.
시험 대신에 강의 중 배운 내용을 활용해야 하는 에세이를 써야합니다.
생물심리학이나 관련된 내용을 배운 분들은 편하게 수업 편하게 듣고 아는 내용을 바탕으로 써도 될거 같아요.
교수님도 엄청 착하시고 성적도 잘 주십니다."
97,BNCS311,뇌및인지과학개론(영강),Christian,2017-2학기,전공필수,3,mooomin,5,3,4,3,5,4,"교수님 정말 친절하십니다....!
출석체크는 랜덤으로 한 학기에 3번 정도 하십니다. 수업도 열심히 하시고, 학점도 잘 주십니다!
중간, 기말이 없고, 모두 레포트로 대체합니다. 영어레포트가 분량은 꽤 되지만, 레포트를 쓰고 나면 해당 주제에 대해서는 아주 깊이 있는 지식을 얻을 수 있습니다."
98,BNCS311,뇌및인지과학개론(영강),Christian,2017-2학기,전공필수,3,하이항하이하이,5,3,3,2,4,3,수업을 잘 가지 않았으나 기본적인 전공지식들 있으면 ppt내용들 알기 쉬워요! 레포트도 점수 잘주시는데 수업 잘 안갔다고 플러스 안붙여주시네요 ㅠㅠ
99,BNCS311,뇌및인지과학개론(영강),Christian,2017-2학기,전공필수,3,sguridang2,4,3,2,3,5,3,"천사 중 천사
학생들의 의견을 굉장히 잘 반영하며, 빌넣 또한 잘 받아주심
뇌 및 감각, 지각 등과 관련된 내용이 주가 됨
시험 없음. 중간 기말 레포트 대체지만 영강이기에 영어로 레포트를 써야 한다는 치명적인 귀찮음이 있음.
성적은 매우 잘 주심. 절대평가의 기준이 낮은 듯함"
100,BNCS311,뇌및인지과학개론(영강),Christian,2017-2학기,전공필수,3,사쩜오내가한다,4,2,2,2,5,3,"2번의 에세이로만 학점이 결정됩니다. 뇌 과학에 관한 전반적인 내용을 들을 수 있는 강의라 좋았습니다. 다만, 자율성이 극대화된 만큼 열의가 없으시면 배워가시는 것두 없습니다. 또한 아쉬웠던 점은 에세이 주제와 형식이 다 주어져 있어서 자율적으로 주제를 가지고 에세이를 쓰지 못한게 좀 아쉽네요ㅠㅠ 에세이는 주로 수업시간에 나온 것에 대한 기능적 설명이 주를 이뤘어서 별루 크게 고민하는 에세이는 아니었네요."
101,BNCS311,뇌및인지과학개론(영강),Christian,2017-2학기,전공필수,3,LNaSuJi,5,1,2,1,5,5,출첵은 거의 안하고 중간 기말 없이 모두 레포트 직성하는 것으로 대체됩니다. 수업방식은 피피티를 통한 시청긱자료를 이용하여 진행하고 교수님 영어발음도 매우 깔끔하여 만족스러운 수업입니다
102,BNCS311,뇌및인지과학개론(영강),Christian,2017-2학기,전공필수,3,쁠쁠쁠,5,2,3,4,4,5,"강의명대로 뇌및인지과학 분야의 개론 수업인지라 입문자들에게 매우 추천하는 강의입니다. 교수님께서 강의력도 뛰어나시고 해당 분야의 최신 연구 자료도 많이 소개해 주셔서 좋았습니다. 중간, 기말고사 시험이 따로 없고 레포트로 대체됩니다. 중간고사에는 약 900-1000자의 에세이 (40%), 기말고사에는 약 1500-2000자의 에세이 (60%)를 제출하면 됩니다. 스스로 많이 찾아봐야 해서 좀 어렵게 느낄 수는 있으나 학점은 매우 잘 주십니다. 출석도 아주 가끔 수업이 끝난 후에 확인하신 후 참석자들에게 보너스 점수를 주십니다."
103,BNCS311,뇌및인지과학개론(영강),Christian,2017-2학기,전공필수,3,kucl,4,2,1,1,4,3,"뇌인지 전공 필수 강의입니다. 영강임에도 불구하고 교수님이 친절하게 설명해주시기 때문에 그렇게 어렵지 않게 강의를 따라갈 수 있었습니다. 출석체크는 랜덤으로 하시지만 그렇게 자주 하시는 편이 아니기도 하고 플러스 요인으로 작용하지 평가요인은 아닙니다. 중간, 기말은 에세이로 대체되며 에세이 평가가 사실상 학점으로 연결됩니다. 에세이는 열심히 준비한 내용이 보이는만큼 주시고 형식도 정해주시기 때문에 빨리 시작할 수록 좋습니다."
104,BNCS311,뇌및인지과학개론(영강),Christian,2017-2학기,전공필수,3,오인광,5,1,2,3,5,3,"흥미로운 뇌과학적 요소들을
생물학적으로, 실험사례 소개로도 다양하게 설명해주시고
강의력도 좋으셔서 집중이잘됩니다

하지만 출첵이 랜덤이고
중간기말없이 중간기말 적당한 난이도의 레퍼트로 대체되기때문에

갈수록 출석율이 많이떨어집니다.


그래도 매번가서 앉아있으면 얻어가는것이많은 수업입니다.

학점은 정 말 잘 주 십 니 다"
105,BNCS311,뇌및인지과학개론(영강),Christian,2017-2학기,전공필수,3,쵸쵸우,3,1,4,3,2,2,"시험이 없기에 수업 내용이 도움이 되지 않는 과목입니다.
그냥 교양이라고 생각하고 가서 듣고싶으면 듣고 듣기 싫으면 안듣는 과목입니다.
시험 대체로 에세이를 쓰는데, 이것이 생각보다 엄청 오래걸리므로 미리미리 준비해둬야하고, 논문을 엄청 많이 인용할수록 점수를 잘주십니다. 영어로 써야하기에 좀 귀찮고, 자신이 없으신분은 그냥 다른 전필 들으세요. 기말기간에 다른 과목들 과제랑 같이할라고 하면 ㄹㅇ 개빡칩니다. 학점도 솔직히 무슨 기준으로 주시는지 잘 모르겠습니다. 출석 뭐 10번 하겠다고 랜덤으로 부르겠다고 첫시간에 그러시고는 10번은 무슨 한 4번 불렀나 싶고, 학점은 그냥 보통으로 받았는데, 중간 기말 에세이마다 학점을 부여하시고, 평균을 내시는데 그게 최종학점인듯합니다."
106,BNCS311,뇌및인지과학개론(영강),Christian,2017-2학기,전공필수,3,학생회좋은분,5,2,2,1,5,4,"통틀어서 출석 5번정도 한것 같습니다.
하지만 출석 안하면 감점시키는게 아니라 출석하면 플러스 점수를 주셔서
절대평가인 만큼 출석 안해도 큰 지장은 없구요

평가는 중간 기말 레포트로 대체하는데
각각 하루,이틀만에 썼지만
문장 그대로 갖다쓰는 것만 아니면 점수는 잘 나오는 것 같습니다!"
107,BNCS311,뇌및인지과학개론(영강),Christian,2017-2학기,전공필수,3,매일매일기다려,4,1,5,3,4,3,"A는 엄청 후하시나 A+은 받기 거의 힘들다고 볼 수 있다.
자기가 공부한 부분만 머리속에 남는듯.. ㅠㅠ"
108,BNCS311,뇌및인지과학개론(영강),Christian,2017-2학기,전공필수,3,polaris27,5,2,3,2,4,5,"The lectures are very interesting and the professor is very good as well. You learn a lot during in the semester. He is also very inclusive in making decisions about the class, like what percentage of attendance to consider for grades. You will have to write two essays and will be graded according to those. He is quite fair when it comes to grading. He is not generous or stingy, it all depends on how you write your essay."
109,BNCS311,뇌및인지과학개론(영강),Christian,2017-2학기,전공필수,3,케빈_가메이로,4,1,3,1,4,3,"출석 체크를 안하시고 중간 기말 모두 논문 작성으로 평가를 하셨습니다. 이번 학기만 그런진 모르겠지만 교수님이 바쁘셔서 그런지 수업을 좀 많이 빼셨네요,, 보강은 블랙보드 영상으로 대체하셨어요. 영어로 쓰는게 익숙하지 않아서 그런지 영어로 제출해야 하는 논문이 저한텐 쉽지 않았네요. 학점은 잘 주십니다. 대신 A+ 받으시려면 논문 엄청 잘쓰셔야 해요."
110,BNCS311,뇌및인지과학개론(영강),Christian,2017-2학기,전공필수,3,미련한곰팅이,5,1,3,4,5,5,"교수님 완전 착하시고 좋아요
성적도 잘 나와요
중간&기말고사는 레포트 대체에요
이 수업"
111,BNCS311,뇌및인지과학개론(영강),Christian,2017-2학기,전공필수,3,눈누난나뿌잉,4,4,3,1,4,3,"겨수님이 세미나 형식으로 수업을 하세요.
필기하실 분은 필기 하셔도 되고
앉아서 이야기 듣듯이 들어도 되고요.
시험은 없고 중간, 기팔 레포트 있습니다."
112,BNCS311,뇌및인지과학개론(영강),Christian,2017-2학기,전공필수,3,크크크크 크크,5,1,4,3,4,5,"출석체크는 감점이 아니라 보너스 점수로 주십니다. 랜덤으로 4번정도 해요.
중간고사 기말고사 없습니다. 레포트로만 평가합니다.
시험은 없지만 수업잘들으면 레포트 쓰는데 도움이 많이됩니다.
레포트는 중간1000자 기말1500자 두번 있는데 많이 부담스럽지는 않습니다.
학점도 레폿을 열심히 써서 내면 A는 받을 수 있습니다. A+도 많이 받는 것 같아요.
시험이 없어서 열심히 공부할 필요는 없지만 내용이 재밌는 것도 많습니다."
113,BNCS311,뇌및인지과학개론(영강),Christian,2017-2학기,전공필수,3,연어먹고싶다,5,2,3,3,5,4,"천사 교수님의 좋은 강의...
수업도 즐겁고 재밌고 내용도 재밌습니다. 출석도 하면 +이고 안해도 크게 문제가 없어요.
에세이로 시험을 대체하는데 에세이 양이 많지도 않고 주제도 내용도 정해주셔서 전혀 부담이 없습니다.
오히려 무언가 외워야 할 부담이 없어서 즐겁게 들을 수 있는 강의입니다.
학점도 진짜 진짜 잘주세요... 진짜 추천합니다"
114,BNCS311,뇌및인지과학개론(영강),Christian,2017-2학기,전공필수,3,groeeen,5,2,3,3,4,4,"출첵은 랜덤으로 5번정도 실행하였고 또 출석 자체가 학점에 큰 영향을 끼친 것 같지는 않습니다..
출첵을 하지는 않지만 교수님께서 인지과학개론에 대해 차근차근 체계적으로 가르쳐주셔서 관심있으신 분들은 가셔서 수업들으시면 큰 도움이 될꺼에요. 또 인성도 정말 ㅠㅠㅠㅠ천사가 아니실까......질문하면 정말 친절하게 답해주십니다..
뇌인지 융전 전필 중에 최고의 과목입니다 그냥 들으세여"
115,BNCS313,뇌및의공학입문(영강),석흥일,2017-2학기,전공필수,3,Kartoshka,3,5,4,4,5,3,"출석체크는 항상 하셨고, 지각 3번인가..하면 F를 주신다는 협박 탓에 압박이 심한 강의.
영강이지만 영어를 아주 그리 잘하진 못해서 좀 알아듣기 어렵긴 한데 집중하고 들으면 아예 안 들리는 편은 아닙니다. 점수는 잘 주시는 편입니다."
116,BNCS313,뇌및의공학입문(영강),석흥일,2017-2학기,전공필수,3,니모,4,5,4,4,3,3,"출석체크는 거의 매일 하십니다. 영강이다보니 수업은 영어로 진행됩니다. 대신 시험볼때는 한글써도 됩니다
FMRI와 관련된 내용의 논문 3개를 영어로 요약하는 것이 과제였고, 그 중 하나를 선택하여 파트너와 함께
발표해야 했습니다. 전 영어를 못하는지라 너무 어려웠는데 다른분들은 어떠셨는지 모르겠네요
열심히 하시면 학점은 잘 받으실 수 있을 것 같습니다. 학습량은 많은 편이었던 것 같습니다"
117,BNCS313,뇌및의공학입문(영강),석흥일,2017-2학기,전공필수,3,killa18,4,5,3,5,3,4,"This course consisted of a midterm and final exam, a presentation (groups of two persons) and 3 homework assignments.

The homework was reading 3 scientific articles approved by the professor based on the topics we discussed in the course and writing a summarization paper for each. The presentation was choosing 2 out of the total 6 articles combined from the homework that you and your partner submitted separately and summarizing and presenting the two articles together.

The material is difficult so it is advisable to review regularly. However, the professor explains the concepts thoroughly and is open to questions and discussion. He's a little funny and awkward but very kind and knowledgable in his field. I enjoyed this course"
